Date,Time,CO(GT),PT08.S1(CO),NMHC(GT),C6H6(GT),PT08.S2(NMHC),NOx(GT),PT08.S3(NOx),NO2(GT),PT08.S4(NO2),PT08.S5(O3),T,RH,AH,Unnamed: 15,Unnamed: 16,Datetime
10/03/2004,18.00.00,,1360.0,150.0,,1046.0,166.0,1056.0,113.0,1692.0,1268.0,"13,6","48,9","0,7578",,,2004-10-03
10/03/2004,19.00.00,2.0,1292.0,112.0,,955.0,103.0,1174.0,92.0,1559.0,972.0,"13,3","47,7","0,7255",,,2004-10-03
10/03/2004,20.00.00,,1402.0,88.0,,939.0,131.0,1140.0,114.0,1555.0,1074.0,"11,9","54,0","0,7502",,,2004-10-03
10/03/2004,21.00.00,,1376.0,80.0,,948.0,172.0,1092.0,122.0,1584.0,1203.0,"11,0","60,0","0,7867",,,2004-10-03
10/03/2004,22.00.00,,1272.0,51.0,,836.0,131.0,1205.0,116.0,1490.0,1110.0,"11,2","59,6","0,7888",,,2004-10-03
10/03/2004,23.00.00,,1197.0,38.0,,750.0,89.0,1337.0,96.0,1393.0,949.0,"11,2","59,2","0,7848",,,2004-10-03
11/03/2004,00.00.00,,1185.0,31.0,,690.0,62.0,1462.0,77.0,1333.0,733.0,"11,3","56,8","0,7603",,,2004-11-03
11/03/2004,01.00.00,1.0,1136.0,31.0,,672.0,62.0,1453.0,76.0,1333.0,730.0,"10,7","60,0","0,7702",,,2004-11-03
11/03/2004,02.00.00,,1094.0,24.0,,609.0,45.0,1579.0,60.0,1276.0,620.0,"10,7","59,7","0,7648",,,2004-11-03
11/03/2004,03.00.00,,1010.0,19.0,,561.0,,1705.0,,1235.0,501.0,"10,3","60,2","0,7517",,,2004-11-03
11/03/2004,04.00.00,-200.0,1011.0,14.0,,527.0,21.0,1818.0,34.0,1197.0,445.0,"10,1","60,5","0,7465",,,2004-11-03
11/03/2004,05.00.00,,1066.0,8.0,,512.0,16.0,1918.0,28.0,1182.0,422.0,"11,0","56,2","0,7366",,,2004-11-03
11/03/2004,06.00.00,,1052.0,16.0,,553.0,34.0,1738.0,48.0,1221.0,472.0,"10,5","58,1","0,7353",,,2004-11-03
11/03/2004,07.00.00,,1144.0,29.0,,667.0,98.0,1490.0,82.0,1339.0,730.0,"10,2","59,6","0,7417",,,2004-11-03
11/03/2004,08.00.00,2.0,1333.0,64.0,,900.0,174.0,1136.0,112.0,1517.0,1102.0,"10,8","57,4","0,7408",,,2004-11-03
11/03/2004,09.00.00,,1351.0,87.0,,960.0,129.0,1079.0,101.0,1583.0,1028.0,"10,5","60,6","0,7691",,,2004-11-03
11/03/2004,10.00.00,,1233.0,77.0,,827.0,112.0,1218.0,98.0,1446.0,860.0,"10,8","58,4","0,7552",,,2004-11-03
11/03/2004,11.00.00,,1179.0,43.0,,762.0,95.0,1328.0,92.0,1362.0,671.0,"10,5","57,9","0,7352",,,2004-11-03
11/03/2004,12.00.00,,1236.0,61.0,,774.0,104.0,1301.0,95.0,1401.0,664.0,"9,5","66,8","0,7951",,,2004-11-03
11/03/2004,13.00.00,,1286.0,63.0,,869.0,146.0,1162.0,112.0,1537.0,799.0,"8,3","76,4","0,8393",,,2004-11-03
11/03/2004,14.00.00,,1371.0,164.0,,1034.0,207.0,983.0,128.0,1730.0,1037.0,"8,0","81,1","0,8736",,,2004-11-03
11/03/2004,15.00.00,,1310.0,79.0,,933.0,184.0,1082.0,126.0,1647.0,946.0,"8,3","79,8","0,8778",,,2004-11-03
11/03/2004,16.00.00,,1292.0,95.0,,912.0,193.0,1103.0,131.0,1591.0,957.0,"9,7","71,2","0,8569",,,2004-11-03
11/03/2004,17.00.00,,1383.0,150.0,,1020.0,243.0,1008.0,135.0,1719.0,1104.0,"9,8","67,6","0,8185",,,2004-11-03
11/03/2004,18.00.00,,1581.0,307.0,,1319.0,281.0,799.0,151.0,2083.0,1409.0,"10,3","64,2","0,8065",,,2004-11-03
11/03/2004,19.00.00,,1776.0,461.0,,1488.0,383.0,702.0,172.0,2333.0,1704.0,"9,7","69,3","0,8319",,,2004-11-03
11/03/2004,20.00.00,,1640.0,401.0,,1404.0,351.0,743.0,165.0,2191.0,1654.0,"9,6","67,8","0,8133",,,2004-11-03
11/03/2004,21.00.00,,1313.0,197.0,,1076.0,240.0,957.0,136.0,1707.0,1285.0,"9,1","64,0","0,7419",,,2004-11-03
11/03/2004,22.00.00,,965.0,61.0,,749.0,94.0,1325.0,85.0,1333.0,821.0,"8,2","63,4","0,6905",,,2004-11-03
11/03/2004,23.00.00,1.0,913.0,26.0,,629.0,47.0,1565.0,53.0,1252.0,552.0,"8,2","60,8","0,6657",,,2004-11-03
12/03/2004,00.00.00,,1080.0,55.0,,805.0,122.0,1254.0,97.0,1375.0,816.0,"8,3","58,5","0,6438",,,2004-12-03
12/03/2004,01.00.00,,1044.0,53.0,,829.0,133.0,1247.0,110.0,1378.0,832.0,"7,7","59,7","0,6308",,,2004-12-03
12/03/2004,02.00.00,,988.0,40.0,,718.0,82.0,1396.0,91.0,1304.0,692.0,"7,1","61,8","0,6276",,,2004-12-03
12/03/2004,03.00.00,,889.0,21.0,,574.0,,1680.0,,1187.0,512.0,"7,0","62,3","0,6261",,,2004-12-03
12/03/2004,04.00.00,-200.0,831.0,10.0,,506.0,21.0,1893.0,32.0,1134.0,384.0,"6,1","65,9","0,6248",,,2004-12-03
12/03/2004,05.00.00,,847.0,7.0,,501.0,30.0,1895.0,44.0,1155.0,394.0,"6,3","65,0","0,6233",,,2004-12-03
12/03/2004,06.00.00,,927.0,17.0,,571.0,56.0,1685.0,71.0,1223.0,487.0,"6,8","62,9","0,6234",,,2004-12-03
12/03/2004,07.00.00,,1091.0,33.0,,730.0,109.0,1387.0,104.0,1361.0,748.0,"6,4","65,1","0,6316",,,2004-12-03
12/03/2004,08.00.00,,1587.0,202.0,,1236.0,307.0,897.0,141.0,1900.0,1400.0,"7,3","63,1","0,6499",,,2004-12-03
12/03/2004,09.00.00,-200.0,1545.0,,,1353.0,,767.0,,2058.0,1588.0,"9,2","56,2","0,6561",,,2004-12-03
12/03/2004,10.00.00,,1350.0,208.0,,1118.0,187.0,912.0,122.0,1712.0,1237.0,"13,2","41,7","0,6320",,,2004-12-03
12/03/2004,11.00.00,,1263.0,166.0,,1037.0,216.0,969.0,143.0,1598.0,1167.0,"14,3","38,4","0,6243",,,2004-12-03
12/03/2004,12.00.00,,1206.0,114.0,,986.0,143.0,1035.0,113.0,1537.0,959.0,"15,0","36,5","0,6195",,,2004-12-03
12/03/2004,13.00.00,,1252.0,140.0,,1016.0,160.0,1008.0,116.0,1593.0,983.0,"16,1","34,5","0,6262",,,2004-12-03
12/03/2004,14.00.00,,1287.0,169.0,,1078.0,163.0,949.0,123.0,1660.0,1061.0,"16,3","35,7","0,6560",,,2004-12-03
12/03/2004,15.00.00,,1353.0,185.0,,1122.0,190.0,922.0,126.0,1740.0,1139.0,"15,8","37,0","0,6610",,,2004-12-03
12/03/2004,16.00.00,,1309.0,165.0,,1073.0,178.0,954.0,120.0,1657.0,1112.0,"15,9","37,2","0,6657",,,2004-12-03
12/03/2004,17.00.00,,1274.0,133.0,,1041.0,150.0,1006.0,119.0,1610.0,994.0,"16,9","34,3","0,6549",,,2004-12-03
12/03/2004,18.00.00,,1510.0,233.0,,1277.0,206.0,812.0,149.0,1910.0,1410.0,"15,1","39,6","0,6766",,,2004-12-03
12/03/2004,19.00.00,,1525.0,242.0,,1246.0,202.0,821.0,145.0,1847.0,1448.0,"14,4","43,4","0,7084",,,2004-12-03
12/03/2004,20.00.00,,1843.0,488.0,,1610.0,340.0,624.0,170.0,2390.0,1887.0,"12,9","50,5","0,7478",,,2004-12-03
12/03/2004,21.00.00,,1598.0,333.0,,1299.0,274.0,752.0,149.0,1941.0,1627.0,"12,1","53,3","0,7536",,,2004-12-03
12/03/2004,22.00.00,,1484.0,215.0,,1127.0,253.0,839.0,139.0,1723.0,1491.0,"11,0","59,1","0,7740",,,2004-12-03
12/03/2004,23.00.00,,1677.0,367.0,,1346.0,300.0,741.0,134.0,2062.0,1657.0,"9,7","64,6","0,7771",,,2004-12-03
13/03/2004,00.00.00,,1280.0,122.0,,964.0,193.0,963.0,113.0,1544.0,1285.0,"9,5","64,1","0,7597",,,
13/03/2004,01.00.00,,1196.0,67.0,,873.0,139.0,1071.0,97.0,1463.0,1144.0,"9,1","63,9","0,7423",,,
13/03/2004,02.00.00,,1184.0,43.0,,782.0,83.0,1176.0,82.0,1365.0,1043.0,"8,8","63,9","0,7256",,,
13/03/2004,03.00.00,,1172.0,46.0,,783.0,,1179.0,,1380.0,996.0,"7,8","67,5","0,7173",,,
13/03/2004,04.00.00,-200.0,1147.0,56.0,,821.0,109.0,1132.0,83.0,1412.0,992.0,"7,0","71,1","0,7158",,,
13/03/2004,05.00.00,1.0,978.0,30.0,,625.0,62.0,1420.0,65.0,1274.0,819.0,"8,3","63,6","0,6982",,,
13/03/2004,06.00.00,,1100.0,27.0,,646.0,53.0,1406.0,60.0,1268.0,835.0,"7,2","67,5","0,6887",,,
13/03/2004,07.00.00,,1112.0,47.0,,770.0,139.0,1228.0,77.0,1409.0,940.0,"6,3","71,9","0,6932",,,
13/03/2004,08.00.00,,1336.0,132.0,,1043.0,256.0,935.0,96.0,1678.0,1192.0,"6,5","71,6","0,6945",,,
13/03/2004,09.00.00,,1408.0,239.0,,1153.0,295.0,830.0,119.0,1777.0,1411.0,"9,6","59,7","0,7124",,,
13/03/2004,10.00.00,,1447.0,160.0,,1081.0,250.0,869.0,126.0,1667.0,1465.0,"12,4","51,2","0,7335",,,
13/03/2004,11.00.00,,1542.0,283.0,,1184.0,296.0,808.0,158.0,1780.0,1583.0,"15,6","42,2","0,7451",,,
13/03/2004,12.00.00,,1451.0,210.0,,1117.0,239.0,875.0,161.0,1679.0,1387.0,"18,4","33,8","0,7090",,,
13/03/2004,13.00.00,,1328.0,154.0,,1059.0,153.0,987.0,124.0,1600.0,1101.0,"19,4","31,3","0,6950",,,
13/03/2004,14.00.00,2.0,1207.0,112.0,,924.0,118.0,1088.0,102.0,1488.0,850.0,"18,0","34,8","0,7127",,,
13/03/2004,15.00.00,2.0,1240.0,108.0,,947.0,119.0,1049.0,116.0,1532.0,947.0,"18,4","33,6","0,7042",,,
13/03/2004,16.00.00,,1306.0,111.0,,987.0,138.0,1004.0,124.0,1554.0,1078.0,"17,6","35,1","0,7012",,,
13/03/2004,17.00.00,,1326.0,97.0,,1000.0,148.0,976.0,125.0,1602.0,1084.0,"16,7","37,8","0,7117",,,
13/03/2004,18.00.00,,1473.0,191.0,,1163.0,227.0,831.0,148.0,1779.0,1395.0,"16,1","41,0","0,7451",,,
13/03/2004,19.00.00,,1609.0,258.0,,1286.0,277.0,758.0,165.0,1922.0,1612.0,"15,8","42,4","0,7569",,,
13/03/2004,20.00.00,,1611.0,284.0,,1274.0,279.0,754.0,161.0,1915.0,1697.0,"15,7","44,1","0,7786",,,
13/03/2004,21.00.00,,1621.0,269.0,,1247.0,283.0,762.0,159.0,1860.0,1886.0,"15,3","46,8","0,8091",,,
13/03/2004,22.00.00,,1444.0,180.0,,1089.0,214.0,844.0,143.0,1748.0,1624.0,"14,6","48,6","0,8060",,,
13/03/2004,23.00.00,,1418.0,116.0,,1010.0,172.0,892.0,130.0,1603.0,1536.0,"14,7","49,3","0,8193",,,
14/03/2004,00.00.00,,1534.0,93.0,,1013.0,190.0,889.0,129.0,1611.0,1535.0,"13,9","53,6","0,8498",,,
14/03/2004,01.00.00,,1484.0,131.0,,1045.0,174.0,880.0,119.0,1624.0,1530.0,"14,6","51,5","0,8536",,,
14/03/2004,02.00.00,,1367.0,92.0,,925.0,128.0,953.0,104.0,1543.0,1337.0,"12,5","58,9","0,8537",,,
14/03/2004,03.00.00,,1344.0,132.0,,968.0,,921.0,,1620.0,1278.0,"11,6","63,4","0,8674",,,
14/03/2004,04.00.00,-200.0,1130.0,56.0,,773.0,70.0,1130.0,82.0,1452.0,1051.0,"12,1","61,1","0,8603",,,
14/03/2004,05.00.00,,1062.0,32.0,,691.0,53.0,1272.0,70.0,1377.0,929.0,"11,5","63,1","0,8533",,,
14/03/2004,06.00.00,1.0,1076.0,29.0,,618.0,44.0,1395.0,63.0,1333.0,872.0,"11,6","62,2","0,8473",,,
14/03/2004,07.00.00,,1028.0,27.0,,615.0,74.0,1384.0,67.0,1340.0,853.0,"10,4","67,6","0,8530",,,
14/03/2004,08.00.00,,1155.0,36.0,,722.0,101.0,1225.0,84.0,1414.0,959.0,"11,6","62,7","0,8530",,,
14/03/2004,09.00.00,,1235.0,57.0,,828.0,118.0,1055.0,83.0,1527.0,1093.0,"12,4","60,0","0,8627",,,
14/03/2004,10.00.00,,1332.0,129.0,,923.0,144.0,952.0,98.0,1614.0,1225.0,"14,5","53,1","0,8728",,,
14/03/2004,11.00.00,,1445.0,148.0,,1009.0,176.0,878.0,114.0,1696.0,1355.0,"16,9","46,1","0,8789",,,
14/03/2004,12.00.00,,1416.0,145.0,,1002.0,161.0,907.0,119.0,1677.0,1262.0,"19,3","38,3","0,8474",,,
14/03/2004,13.00.00,2.0,1281.0,93.0,,880.0,113.0,1084.0,104.0,1525.0,980.0,"21,2","31,4","0,7812",,,
14/03/2004,14.00.00,,1207.0,84.0,,879.0,103.0,1104.0,102.0,1490.0,872.0,"21,4","30,2","0,7616",,,
14/03/2004,15.00.00,,1258.0,99.0,,906.0,112.0,1081.0,107.0,1511.0,900.0,"21,9","29,0","0,7525",,,
14/03/2004,16.00.00,3.0,1458.0,150.0,,1045.0,170.0,974.0,129.0,1646.0,1099.0,"22,2","28,4","0,7516",,,
14/03/2004,17.00.00,,1438.0,156.0,,1051.0,180.0,943.0,128.0,1668.0,1206.0,"21,3","30,8","0,7696",,,
14/03/2004,18.00.00,,1478.0,122.0,,1055.0,160.0,929.0,121.0,1671.0,1262.0,"19,7","36,7","0,8307",,,
14/03/2004,19.00.00,,1808.0,262.0,,1312.0,261.0,753.0,157.0,1993.0,1698.0,"18,4","41,7","0,8732",,,
14/03/2004,20.00.00,,1898.0,341.0,,1381.0,325.0,681.0,173.0,2103.0,1905.0,"17,6","46,1","0,9210",,,
14/03/2004,21.00.00,,1560.0,214.0,,1140.0,217.0,784.0,146.0,1818.0,1648.0,"16,7","49,6","0,9320",,,
14/03/2004,22.00.00,,1324.0,100.0,,940.0,146.0,924.0,121.0,1587.0,1423.0,"16,3","51,0","0,9341",,,
14/03/2004,23.00.00,,1349.0,79.0,,933.0,152.0,933.0,119.0,1617.0,1349.0,"14,7","55,9","0,9314",,,
15/03/2004,00.00.00,,1239.0,66.0,,872.0,104.0,985.0,99.0,1547.0,1250.0,"14,8","54,7","0,9164",,,
15/03/2004,01.00.00,,1239.0,73.0,,853.0,106.0,1010.0,93.0,1543.0,1174.0,"14,0","57,0","0,9094",,,
15/03/2004,02.00.00,,1224.0,66.0,,855.0,108.0,998.0,88.0,1566.0,1149.0,"13,4","61,3","0,9361",,,
15/03/2004,03.00.00,,1078.0,44.0,,734.0,,1128.0,,1487.0,1021.0,"12,6","63,5","0,9230",,,
15/03/2004,04.00.00,-200.0,1078.0,44.0,,711.0,66.0,1150.0,71.0,1468.0,1013.0,"12,3","65,4","0,9351",,,
15/03/2004,05.00.00,1.0,1075.0,39.0,,703.0,88.0,1156.0,74.0,1464.0,1010.0,"11,9","67,4","0,9375",,,
15/03/2004,06.00.00,,1157.0,51.0,,830.0,138.0,1030.0,80.0,1584.0,1083.0,"11,4","70,5","0,9475",,,
15/03/2004,07.00.00,,1314.0,107.0,,966.0,228.0,897.0,89.0,1710.0,1235.0,"11,3","70,2","0,9401",,,
15/03/2004,08.00.00,,1797.0,336.0,,1451.0,360.0,652.0,114.0,2323.0,1680.0,"12,4","63,9","0,9170",,,
15/03/2004,09.00.00,,1961.0,618.0,,1701.0,478.0,537.0,149.0,2665.0,2184.0,"14,8","54,3","0,9076",,,
15/03/2004,10.00.00,,1771.0,438.0,,1470.0,394.0,622.0,157.0,2262.0,1973.0,"17,4","45,6","0,8993",,,
15/03/2004,11.00.00,,1564.0,334.0,,1300.0,319.0,710.0,155.0,2029.0,1798.0,"19,8","38,5","0,8801",,,
15/03/2004,12.00.00,,1430.0,221.0,,1120.0,201.0,831.0,134.0,1783.0,1522.0,"22,0","34,1","0,8904",,,
15/03/2004,13.00.00,,1417.0,207.0,,1146.0,171.0,830.0,119.0,1831.0,1404.0,"23,3","32,2","0,9096",,,
15/03/2004,14.00.00,,1400.0,191.0,,1162.0,159.0,838.0,111.0,1829.0,1263.0,"23,9","30,0","0,8757",,,
15/03/2004,15.00.00,,1317.0,185.0,,1053.0,153.0,926.0,104.0,1707.0,1137.0,"24,4","28,9","0,8736",,,
15/03/2004,16.00.00,,1318.0,141.0,,1033.0,143.0,950.0,99.0,1675.0,1068.0,"24,4","29,4","0,8848",,,
15/03/2004,17.00.00,,1445.0,214.0,,1141.0,156.0,857.0,110.0,1824.0,1252.0,"23,8","31,3","0,9137",,,
15/03/2004,18.00.00,,1917.0,471.0,,1601.0,314.0,631.0,162.0,2447.0,1843.0,"22,5","35,4","0,9547",,,
15/03/2004,19.00.00,8.0,2040.0,685.0,,1754.0,404.0,542.0,187.0,2679.0,2122.0,"20,4","42,5","1,0086",,,
15/03/2004,20.00.00,,1895.0,538.0,,1573.0,320.0,565.0,165.0,2443.0,1992.0,"18,3","52,6","1,0945",,,
15/03/2004,21.00.00,,1595.0,319.0,,1294.0,256.0,678.0,145.0,2058.0,1707.0,"16,7","57,4","1,0786",,,
15/03/2004,22.00.00,,1439.0,224.0,,1159.0,193.0,764.0,125.0,1856.0,1494.0,"15,7","60,2","1,0654",,,
15/03/2004,23.00.00,,1142.0,67.0,,852.0,89.0,1008.0,101.0,1547.0,1164.0,"15,3","61,4","1,0580",,,
16/03/2004,00.00.00,,1304.0,155.0,,1019.0,127.0,852.0,103.0,1731.0,1272.0,"14,1","65,7","1,0494",,,
16/03/2004,01.00.00,,1074.0,49.0,,784.0,79.0,1098.0,88.0,1483.0,1040.0,"14,8","60,6","1,0148",,,
16/03/2004,02.00.00,,968.0,29.0,,640.0,43.0,1320.0,61.0,1386.0,867.0,"14,8","59,2","0,9879",,,
16/03/2004,03.00.00,,929.0,25.0,,608.0,,1376.0,,1364.0,826.0,"13,6","62,1","0,9636",,,
16/03/2004,04.00.00,-200.0,941.0,25.0,,626.0,59.0,1316.0,59.0,1373.0,840.0,"12,3","66,2","0,9450",,,
16/03/2004,05.00.00,,937.0,17.0,,585.0,38.0,1412.0,52.0,1348.0,793.0,"12,8","63,2","0,9283",,,
16/03/2004,06.00.00,,1017.0,27.0,,681.0,82.0,1246.0,64.0,1418.0,870.0,"11,2","68,5","0,9081",,,
16/03/2004,07.00.00,,1171.0,50.0,,770.0,99.0,1162.0,70.0,1467.0,930.0,"11,0","66,5","0,8705",,,
16/03/2004,08.00.00,,1541.0,218.0,,1185.0,263.0,770.0,97.0,1889.0,1407.0,"11,7","63,7","0,8719",,,
16/03/2004,09.00.00,,1539.0,285.0,,1287.0,229.0,698.0,95.0,2055.0,1507.0,"13,6","56,3","0,8743",,,
16/03/2004,10.00.00,,1735.0,437.0,,1431.0,396.0,628.0,150.0,2211.0,1843.0,"17,8","42,9","0,8672",,,
16/03/2004,11.00.00,,1571.0,327.0,,1297.0,314.0,730.0,162.0,1973.0,1729.0,"21,4","33,3","0,8417",,,
16/03/2004,12.00.00,,1452.0,283.0,,1250.0,217.0,776.0,154.0,1868.0,1583.0,"24,4","27,4","0,8231",,,
16/03/2004,13.00.00,4.0,1579.0,366.0,,1359.0,252.0,724.0,161.0,1998.0,1671.0,"25,3","26,1","0,8264",,,
16/03/2004,14.00.00,,1466.0,318.0,,1309.0,263.0,773.0,161.0,1897.0,1491.0,"25,8","23,2","0,7589",,,
16/03/2004,15.00.00,,1280.0,228.0,,1136.0,180.0,893.0,128.0,1675.0,1240.0,"27,0","20,2","0,7094",,,
16/03/2004,16.00.00,,1407.0,201.0,,1197.0,184.0,905.0,129.0,1759.0,1313.0,"28,2","18,6","0,7014",,,
16/03/2004,17.00.00,,1389.0,199.0,,1173.0,190.0,898.0,133.0,1739.0,1363.0,"28,0","19,1","0,7098",,,
16/03/2004,18.00.00,,1447.0,237.0,,1235.0,184.0,859.0,139.0,1778.0,1296.0,"23,9","25,7","0,7519",,,
16/03/2004,19.00.00,,1551.0,261.0,,1271.0,181.0,800.0,137.0,1875.0,1432.0,"21,3","34,8","0,8730",,,
16/03/2004,20.00.00,,1474.0,230.0,,1173.0,166.0,854.0,143.0,1776.0,1432.0,"20,4","36,7","0,8704",,,
16/03/2004,21.00.00,,1800.0,349.0,,1426.0,317.0,700.0,177.0,2106.0,2034.0,"19,0","41,3","0,9007",,,
16/03/2004,22.00.00,,1379.0,183.0,,1101.0,184.0,818.0,138.0,1710.0,1602.0,"17,9","45,9","0,9342",,,
16/03/2004,23.00.00,,1201.0,88.0,,943.0,130.0,935.0,117.0,1560.0,1362.0,"16,7","48,9","0,9226",,,
17/03/2004,00.00.00,,1205.0,85.0,,925.0,132.0,922.0,107.0,1547.0,1314.0,"15,5","52,9","0,9271",,,
17/03/2004,01.00.00,,1072.0,47.0,,784.0,95.0,1066.0,90.0,1442.0,1114.0,"15,5","51,9","0,9059",,,
17/03/2004,02.00.00,,998.0,34.0,,714.0,70.0,1169.0,79.0,1383.0,992.0,"14,1","55,6","0,8910",,,
17/03/2004,03.00.00,,933.0,26.0,,625.0,,1292.0,,1332.0,884.0,"13,1","57,9","0,8666",,,
17/03/2004,04.00.00,-200.0,883.0,17.0,,577.0,54.0,1396.0,60.0,1303.0,808.0,"12,7","57,9","0,8447",,,
17/03/2004,05.00.00,,869.0,11.0,,554.0,28.0,1460.0,40.0,1268.0,667.0,"11,8","58,0","0,8026",,,
17/03/2004,06.00.00,,891.0,18.0,,576.0,46.0,1417.0,53.0,1289.0,733.0,"11,9","57,4","0,7978",,,
17/03/2004,07.00.00,,1173.0,84.0,,878.0,160.0,1038.0,84.0,1556.0,1052.0,"9,9","65,2","0,7956",,,
17/03/2004,08.00.00,,1587.0,260.0,,1334.0,320.0,702.0,108.0,1999.0,1534.0,"11,1","60,2","0,7958",,,
17/03/2004,09.00.00,,1852.0,534.0,,1696.0,377.0,553.0,127.0,2535.0,1931.0,"14,1","50,0","0,8020",,,
17/03/2004,10.00.00,,1522.0,368.0,,1331.0,280.0,703.0,134.0,2026.0,1734.0,"17,7","40,1","0,8048",,,
17/03/2004,11.00.00,,1438.0,200.0,,1161.0,221.0,819.0,135.0,1782.0,1595.0,"21,1","33,4","0,8265",,,
17/03/2004,12.00.00,,1393.0,145.0,,1067.0,210.0,905.0,142.0,1654.0,1490.0,"24,3","28,3","0,8471",,,
17/03/2004,13.00.00,,1452.0,188.0,,1152.0,204.0,861.0,153.0,1747.0,1508.0,"25,6","25,6","0,8254",,,
17/03/2004,14.00.00,,1389.0,152.0,,1108.0,161.0,887.0,123.0,1712.0,1334.0,"25,9","25,9","0,8503",,,
17/03/2004,15.00.00,2.0,1207.0,103.0,,994.0,135.0,1013.0,104.0,1520.0,1045.0,"26,8","18,7","0,6500",,,
17/03/2004,16.00.00,,1365.0,193.0,,1154.0,186.0,940.0,129.0,1679.0,1221.0,"29,3","15,8","0,6309",,,
17/03/2004,17.00.00,,1247.0,134.0,,1060.0,147.0,1032.0,114.0,1525.0,1069.0,"28,5","14,9","0,5708",,,
17/03/2004,18.00.00,5.0,1557.0,386.0,,1478.0,299.0,793.0,158.0,1981.0,1569.0,"25,9","16,0","0,5237",,,
17/03/2004,19.00.00,,1973.0,577.0,,1737.0,411.0,617.0,194.0,2414.0,2306.0,"23,1","26,5","0,7403",,,
17/03/2004,20.00.00,,1975.0,523.0,,1667.0,347.0,597.0,182.0,2416.0,2359.0,"20,5","38,2","0,9133",,,
17/03/2004,21.00.00,,1795.0,472.0,,1485.0,336.0,653.0,180.0,2174.0,2050.0,"19,1","42,6","0,9294",,,
17/03/2004,22.00.00,,1444.0,206.0,,1150.0,202.0,770.0,136.0,1727.0,1727.0,"17,2","44,1","0,8558",,,
17/03/2004,23.00.00,,1488.0,216.0,,1171.0,178.0,731.0,127.0,1778.0,1705.0,"16,0","50,9","0,9206",,,
18/03/2004,00.00.00,,1371.0,159.0,,1083.0,154.0,796.0,116.0,1669.0,1551.0,"14,8","53,9","0,9024",,,
18/03/2004,01.00.00,,1161.0,70.0,,904.0,92.0,947.0,107.0,1502.0,1240.0,"14,3","55,4","0,8975",,,
18/03/2004,02.00.00,1.0,1064.0,44.0,,787.0,61.0,1057.0,88.0,1407.0,1115.0,"14,8","52,1","0,8686",,,
18/03/2004,03.00.00,,970.0,42.0,,687.0,,1196.0,,1351.0,969.0,"13,9","53,9","0,8501",,,
18/03/2004,04.00.00,-200.0,954.0,28.0,,645.0,60.0,1260.0,78.0,1334.0,925.0,"11,6","61,9","0,8442",,,
18/03/2004,05.00.00,,931.0,20.0,,623.0,37.0,1293.0,57.0,1307.0,828.0,"12,0","58,9","0,8233",,,
18/03/2004,06.00.00,,938.0,26.0,,650.0,68.0,1251.0,71.0,1333.0,893.0,"10,9","62,1","0,8113",,,
18/03/2004,07.00.00,,1166.0,78.0,,885.0,139.0,1005.0,85.0,1551.0,1075.0,"10,6","63,3","0,8067",,,
18/03/2004,08.00.00,,1643.0,319.0,,1384.0,339.0,667.0,124.0,2094.0,1610.0,"11,5","60,0","0,8117",,,
18/03/2004,09.00.00,,1934.0,506.0,,1682.0,421.0,541.0,151.0,2468.0,2051.0,"14,3","50,6","0,8186",,,
18/03/2004,10.00.00,,1617.0,,,1333.0,349.0,686.0,150.0,2010.0,1819.0,"17,8","40,5","0,8210",,,
18/03/2004,11.00.00,,1473.0,,,1127.0,224.0,831.0,152.0,1752.0,1568.0,"20,8","34,4","0,8365",,,
18/03/2004,12.00.00,,1379.0,,,1068.0,171.0,899.0,139.0,1663.0,1374.0,"23,8","28,2","0,8219",,,
18/03/2004,13.00.00,,1385.0,,,1056.0,149.0,891.0,133.0,1648.0,1268.0,"24,2","28,7","0,8515",,,
18/03/2004,14.00.00,,1379.0,,,1087.0,137.0,901.0,126.0,1660.0,1144.0,"25,2","24,9","0,7829",,,
18/03/2004,15.00.00,,1322.0,,,1129.0,149.0,934.0,128.0,1639.0,1109.0,"27,0","17,8","0,6275",,,
18/03/2004,16.00.00,,1496.0,,,1205.0,172.0,822.0,169.0,1767.0,1347.0,"27,1","23,1","0,8180",,,
18/03/2004,17.00.00,,1409.0,,,1131.0,166.0,873.0,149.0,1689.0,1206.0,"25,8","23,9","0,7832",,,
18/03/2004,18.00.00,,1513.0,,,1338.0,214.0,764.0,156.0,1957.0,1397.0,"23,0","26,8","0,7446",,,
18/03/2004,19.00.00,,1667.0,,,1464.0,280.0,683.0,168.0,2118.0,1588.0,"20,7","31,1","0,7523",,,
18/03/2004,20.00.00,,1667.0,,,1453.0,276.0,684.0,176.0,2051.0,1569.0,"18,6","36,2","0,7676",,,
18/03/2004,21.00.00,,1430.0,,,1121.0,178.0,814.0,135.0,1732.0,1322.0,"16,0","48,4","0,8768",,,
18/03/2004,22.00.00,,1333.0,,,989.0,129.0,885.0,121.0,1621.0,1194.0,"14,5","57,8","0,9456",,,
18/03/2004,23.00.00,,1262.0,,,911.0,95.0,948.0,99.0,1545.0,1062.0,"13,1","64,2","0,9606",,,
19/03/2004,00.00.00,2.0,1287.0,,,936.0,126.0,918.0,106.0,1606.0,1040.0,"12,0","69,7","0,9735",,,
19/03/2004,01.00.00,,1134.0,,,840.0,103.0,1021.0,96.0,1501.0,917.0,"11,9","71,1","0,9915",,,
19/03/2004,02.00.00,,999.0,,,688.0,48.0,1229.0,63.0,1380.0,594.0,"12,5","69,3","1,0029",,,
19/03/2004,03.00.00,,961.0,,,622.0,,1382.0,,1301.0,430.0,"12,5","67,5","0,9768",,,
19/03/2004,04.00.00,-200.0,934.0,,,569.0,20.0,1440.0,32.0,1280.0,397.0,"12,3","67,7","0,9665",,,
19/03/2004,05.00.00,,913.0,,,525.0,18.0,1620.0,28.0,1260.0,370.0,"12,5","66,8","0,9620",,,
19/03/2004,06.00.00,,969.0,,,607.0,56.0,1373.0,61.0,1324.0,438.0,"12,3","66,3","0,9487",,,
19/03/2004,07.00.00,,1182.0,,,845.0,115.0,1054.0,99.0,1539.0,704.0,"12,4","64,9","0,9332",,,
19/03/2004,08.00.00,,1740.0,,,1372.0,320.0,671.0,157.0,2144.0,1476.0,"13,0","61,6","0,9209",,,
19/03/2004,09.00.00,,1819.0,,,1582.0,357.0,575.0,166.0,2456.0,1716.0,"13,6","58,8","0,9120",,,
19/03/2004,10.00.00,4.0,1427.0,,,1275.0,253.0,701.0,149.0,1980.0,1398.0,"13,9","57,1","0,9032",,,
19/03/2004,11.00.00,,1390.0,,,1191.0,218.0,759.0,135.0,1879.0,1268.0,"14,5","54,4","0,8917",,,
19/03/2004,12.00.00,,1283.0,,,1117.0,192.0,813.0,127.0,1751.0,1188.0,"15,5","50,1","0,8744",,,
19/03/2004,13.00.00,3.0,1304.0,,,1157.0,176.0,793.0,122.0,1801.0,1171.0,"16,1","47,6","0,8655",,,
19/03/2004,14.00.00,,1364.0,,,1202.0,198.0,771.0,135.0,1875.0,1250.0,"16,3","47,1","0,8640",,,
19/03/2004,15.00.00,,1410.0,,,1268.0,212.0,724.0,139.0,1957.0,1344.0,"16,4","47,5","0,8791",,,
19/03/2004,16.00.00,4.0,1476.0,,,1280.0,249.0,708.0,147.0,1955.0,1378.0,"16,1","50,2","0,9094",,,
19/03/2004,17.00.00,,1522.0,,,1320.0,270.0,690.0,158.0,2005.0,1435.0,"16,0","50,7","0,9142",,,
19/03/2004,18.00.00,,1442.0,,,1301.0,231.0,704.0,146.0,1952.0,1372.0,"15,8","50,3","0,8989",,,
19/03/2004,19.00.00,,1469.0,,,1344.0,251.0,677.0,144.0,1997.0,1471.0,"15,5","50,6","0,8840",,,
19/03/2004,20.00.00,,1467.0,,,1292.0,210.0,698.0,138.0,1942.0,1439.0,"15,4","51,4","0,8956",,,
19/03/2004,21.00.00,4.0,1421.0,,,1202.0,249.0,748.0,143.0,1854.0,1429.0,"15,2","53,1","0,9117",,,
19/03/2004,22.00.00,,1175.0,,,945.0,143.0,904.0,116.0,1604.0,1081.0,"14,7","57,6","0,9573",,,
19/03/2004,23.00.00,,1215.0,,,912.0,127.0,948.0,109.0,1547.0,993.0,"14,2","58,3","0,9380",,,
20/03/2004,00.00.00,,1127.0,,,802.0,104.0,1064.0,92.0,1447.0,837.0,"13,8","57,9","0,9085",,,
20/03/2004,01.00.00,,1090.0,,,773.0,86.0,1105.0,83.0,1429.0,761.0,"13,9","55,9","0,8842",,,
20/03/2004,02.00.00,,1017.0,,,718.0,74.0,1182.0,81.0,1382.0,650.0,"13,9","55,6","0,8765",,,
20/03/2004,03.00.00,,997.0,,,677.0,,1252.0,,1359.0,591.0,"13,8","55,1","0,8666",,,
20/03/2004,04.00.00,-200.0,945.0,,,646.0,44.0,1308.0,55.0,1332.0,505.0,"13,8","54,6","0,8574",,,
20/03/2004,05.00.00,,956.0,,,661.0,42.0,1260.0,53.0,1351.0,518.0,"13,6","55,1","0,8560",,,
20/03/2004,06.00.00,,966.0,,,622.0,63.0,1317.0,67.0,1342.0,571.0,"13,6","59,0","0,9129",,,
20/03/2004,07.00.00,,1064.0,,,728.0,115.0,1161.0,91.0,1461.0,842.0,"13,5","58,4","0,8960",,,
20/03/2004,08.00.00,,1300.0,,,935.0,170.0,902.0,113.0,1623.0,1145.0,"13,8","58,0","0,9083",,,
20/03/2004,09.00.00,,1348.0,,,998.0,147.0,834.0,102.0,1689.0,1218.0,"14,6","53,1","0,8765",,,
20/03/2004,10.00.00,,1425.0,,,1068.0,166.0,776.0,107.0,1764.0,1341.0,"15,0","52,3","0,8881",,,
20/03/2004,11.00.00,,1474.0,,,1061.0,195.0,768.0,113.0,1768.0,1406.0,"15,4","52,1","0,9046",,,
20/03/2004,12.00.00,,1490.0,,,1039.0,182.0,782.0,108.0,1757.0,1422.0,"16,3","50,0","0,9158",,,
20/03/2004,13.00.00,,1495.0,,,1040.0,168.0,809.0,105.0,1735.0,1373.0,"17,1","47,9","0,9281",,,
20/03/2004,14.00.00,,1376.0,,,953.0,125.0,900.0,93.0,1636.0,1153.0,"19,0","42,9","0,9370",,,
20/03/2004,15.00.00,,1305.0,,,884.0,95.0,980.0,87.0,1573.0,927.0,"19,5","42,3","0,9476",,,
20/03/2004,16.00.00,,1283.0,,,844.0,79.0,1036.0,76.0,1539.0,766.0,"19,5","42,3","0,9493",,,
20/03/2004,17.00.00,,1392.0,,,967.0,119.0,930.0,94.0,1649.0,941.0,"19,1","43,8","0,9556",,,
20/03/2004,18.00.00,,1452.0,,,1063.0,142.0,856.0,110.0,1774.0,1146.0,"18,5","46,3","0,9744",,,
20/03/2004,19.00.00,,1633.0,,,1199.0,215.0,734.0,136.0,1919.0,1417.0,"17,4","51,6","1,0159",,,
20/03/2004,20.00.00,,1625.0,,,1191.0,229.0,733.0,139.0,1885.0,1442.0,"17,1","51,3","0,9914",,,
20/03/2004,21.00.00,,1535.0,,,1108.0,206.0,785.0,125.0,1820.0,1323.0,"16,4","53,8","0,9964",,,
20/03/2004,22.00.00,,1323.0,,,973.0,147.0,864.0,111.0,1712.0,1125.0,"16,2","55,4","1,0132",,,
20/03/2004,23.00.00,,1309.0,,,937.0,122.0,905.0,97.0,1672.0,1036.0,"15,9","57,7","1,0356",,,
21/03/2004,00.00.00,,1456.0,,,999.0,175.0,835.0,107.0,1714.0,1202.0,"15,7","58,6","1,0396",,,
21/03/2004,01.00.00,,1300.0,,,872.0,133.0,941.0,90.0,1577.0,1054.0,"15,1","60,9","1,0398",,,
21/03/2004,02.00.00,,1203.0,,,823.0,89.0,1004.0,84.0,1526.0,903.0,"15,6","56,6","0,9951",,,
21/03/2004,03.00.00,,1195.0,,,836.0,,987.0,,1554.0,885.0,"15,2","57,9","0,9941",,,
21/03/2004,04.00.00,-200.0,1117.0,,,802.0,85.0,1029.0,87.0,1539.0,818.0,"15,4","57,8","1,0021",,,
21/03/2004,05.00.00,,1062.0,,,711.0,55.0,1136.0,66.0,1461.0,700.0,"14,9","60,6","1,0196",,,
21/03/2004,06.00.00,,947.0,,,594.0,24.0,1300.0,36.0,1390.0,580.0,"14,5","63,0","1,0316",,,
21/03/2004,07.00.00,,1065.0,,,687.0,72.0,1143.0,62.0,1492.0,815.0,"14,2","66,2","1,0630",,,
21/03/2004,08.00.00,,1155.0,,,734.0,122.0,1062.0,91.0,1528.0,1035.0,"14,5","65,3","1,0704",,,
21/03/2004,09.00.00,,1220.0,,,782.0,111.0,996.0,89.0,1560.0,1067.0,"15,3","62,1","1,0730",,,
21/03/2004,10.00.00,,1301.0,,,862.0,123.0,914.0,93.0,1633.0,1114.0,"16,3","59,0","1,0868",,,
21/03/2004,11.00.00,,1279.0,,,870.0,106.0,911.0,81.0,1646.0,1000.0,"18,9","49,6","1,0700",,,
21/03/2004,12.00.00,,1267.0,,,883.0,103.0,953.0,82.0,1617.0,906.0,"19,4","46,1","1,0249",,,
21/03/2004,13.00.00,,1239.0,,,848.0,102.0,981.0,80.0,1568.0,822.0,"20,8","41,6","1,0091",,,
21/03/2004,14.00.00,,1128.0,,,742.0,48.0,1144.0,48.0,1507.0,610.0,"21,4","40,3","1,0126",,,
21/03/2004,15.00.00,,1243.0,,,916.0,63.0,962.0,61.0,1669.0,657.0,"21,2","39,3","0,9791",,,
21/03/2004,16.00.00,,1208.0,,,853.0,98.0,1060.0,89.0,1506.0,647.0,"20,3","38,0","0,8942",,,
21/03/2004,17.00.00,,1306.0,,,938.0,132.0,961.0,105.0,1607.0,762.0,"19,4","41,3","0,9206",,,
21/03/2004,18.00.00,,1546.0,,,1151.0,173.0,769.0,116.0,1874.0,1122.0,"18,5","43,8","0,9252",,,
21/03/2004,19.00.00,,1501.0,,,1071.0,185.0,823.0,119.0,1744.0,1130.0,"17,8","48,1","0,9689",,,
21/03/2004,20.00.00,,1605.0,,,1153.0,266.0,769.0,144.0,1840.0,1637.0,"17,9","46,9","0,9520",,,
21/03/2004,21.00.00,,1316.0,,,974.0,188.0,883.0,123.0,1673.0,1272.0,"17,4","49,1","0,9688",,,
21/03/2004,22.00.00,,1195.0,,,898.0,122.0,933.0,105.0,1594.0,1098.0,"17,0","51,7","0,9914",,,
21/03/2004,23.00.00,,1211.0,,,896.0,112.0,920.0,93.0,1624.0,1066.0,"16,4","55,1","1,0198",,,
22/03/2004,00.00.00,,1161.0,,,815.0,93.0,995.0,86.0,1582.0,909.0,"16,1","60,0","1,0919",,,
22/03/2004,01.00.00,,1095.0,,,767.0,74.0,1050.0,76.0,1547.0,818.0,"15,8","60,5","1,0805",,,
22/03/2004,02.00.00,,897.0,,,563.0,23.0,1417.0,33.0,1355.0,472.0,"16,3","57,0","1,0491",,,
22/03/2004,03.00.00,,842.0,,,468.0,,1813.0,,1274.0,394.0,"16,9","53,9","1,0309",,,
22/03/2004,04.00.00,-200.0,854.0,,,481.0,17.0,1756.0,27.0,1304.0,396.0,"16,1","55,9","1,0153",,,
22/03/2004,05.00.00,,845.0,,,472.0,15.0,1786.0,23.0,1278.0,378.0,"16,5","53,9","1,0049",,,
22/03/2004,06.00.00,,942.0,,,586.0,41.0,1480.0,46.0,1373.0,432.0,"16,4","54,0","0,9979",,,
22/03/2004,07.00.00,,1090.0,,,768.0,86.0,1072.0,76.0,1538.0,699.0,"15,7","57,6","1,0195",,,
22/03/2004,08.00.00,,1514.0,,,1230.0,226.0,732.0,116.0,1996.0,1252.0,"15,8","53,7","0,9571",,,
22/03/2004,09.00.00,,1379.0,,,1252.0,214.0,711.0,115.0,1962.0,1237.0,"17,4","42,1","0,8281",,,
22/03/2004,10.00.00,,1074.0,,,854.0,115.0,1032.0,83.0,1484.0,772.0,"17,9","38,4","0,7793",,,
22/03/2004,11.00.00,,1090.0,,,868.0,124.0,1026.0,87.0,1509.0,766.0,"18,5","36,7","0,7764",,,
22/03/2004,12.00.00,,1110.0,,,964.0,122.0,947.0,90.0,1577.0,829.0,"21,0","29,6","0,7263",,,
22/03/2004,13.00.00,2.0,1102.0,,,994.0,107.0,955.0,87.0,1599.0,783.0,"21,3","28,1","0,7067",,,
22/03/2004,14.00.00,,1100.0,,,1021.0,133.0,952.0,99.0,1607.0,822.0,"21,3","26,1","0,6539",,,
22/03/2004,15.00.00,,1094.0,,,1003.0,130.0,965.0,99.0,1574.0,813.0,"21,3","26,8","0,6681",,,
22/03/2004,16.00.00,,1076.0,451.0,,1034.0,150.0,964.0,101.0,1544.0,813.0,"21,3","24,2","0,6060",,,
22/03/2004,17.00.00,,1152.0,185.0,,1062.0,138.0,928.0,103.0,1606.0,850.0,"20,2","28,5","0,6682",,,
22/03/2004,18.00.00,,1407.0,426.0,,1249.0,213.0,720.0,129.0,1932.0,1276.0,"17,0","43,1","0,8264",,,
22/03/2004,19.00.00,,1438.0,672.0,,1325.0,232.0,678.0,143.0,1993.0,1401.0,"15,6","47,4","0,8347",,,
22/03/2004,20.00.00,,1425.0,624.0,,1325.0,238.0,678.0,146.0,1965.0,1356.0,"15,3","47,4","0,8178",,,
22/03/2004,21.00.00,,1279.0,325.0,,1131.0,180.0,775.0,124.0,1758.0,1243.0,"14,5","49,7","0,8177",,,
22/03/2004,22.00.00,2.0,1132.0,143.0,,916.0,128.0,920.0,113.0,1561.0,1083.0,"13,9","52,0","0,8231",,,
22/03/2004,23.00.00,,1006.0,89.0,,729.0,65.0,1142.0,80.0,1370.0,795.0,"14,5","49,4","0,8106",,,
23/03/2004,00.00.00,,982.0,73.0,,700.0,53.0,1204.0,72.0,1359.0,735.0,"13,8","51,4","0,8071",,,
23/03/2004,01.00.00,,969.0,48.0,,636.0,47.0,1271.0,64.0,1309.0,684.0,"14,0","51,3","0,8163",,,
23/03/2004,02.00.00,,941.0,47.0,,621.0,51.0,1298.0,70.0,1330.0,714.0,"13,0","56,8","0,8444",,,
23/03/2004,03.00.00,,892.0,36.0,,522.0,,1522.0,,1285.0,456.0,"11,0","70,0","0,9215",,,
23/03/2004,04.00.00,-200.0,855.0,25.0,,478.0,20.0,1701.0,31.0,1261.0,401.0,"10,1","76,8","0,9483",,,
23/03/2004,05.00.00,,834.0,19.0,,459.0,13.0,1908.0,22.0,1212.0,361.0,"8,8","80,5","0,9147",,,
23/03/2004,06.00.00,,909.0,26.0,,567.0,33.0,1542.0,47.0,1287.0,418.0,"9,6","75,4","0,9004",,,
23/03/2004,07.00.00,,1061.0,60.0,,745.0,103.0,1178.0,88.0,1429.0,616.0,"9,8","75,0","0,9093",,,
23/03/2004,08.00.00,3.0,1441.0,248.0,,1124.0,224.0,851.0,130.0,1829.0,1089.0,"10,0","74,2","0,9117",,,
23/03/2004,09.00.00,,1498.0,535.0,,1325.0,244.0,684.0,132.0,2095.0,1329.0,"11,2","69,7","0,9232",,,
23/03/2004,10.00.00,,1343.0,340.0,,1185.0,237.0,760.0,132.0,1857.0,1311.0,"12,0","62,9","0,8803",,,
23/03/2004,11.00.00,3.0,1308.0,325.0,,1166.0,220.0,792.0,131.0,1794.0,1236.0,"12,8","55,8","0,8210",,,
23/03/2004,12.00.00,,1209.0,267.0,,1097.0,207.0,837.0,129.0,1746.0,1147.0,"13,1","54,8","0,8234",,,
23/03/2004,13.00.00,,1310.0,325.0,,1207.0,208.0,770.0,132.0,1847.0,1301.0,"13,8","53,4","0,8351",,,
23/03/2004,14.00.00,,1171.0,268.0,,1064.0,160.0,881.0,110.0,1639.0,1097.0,"16,0","42,4","0,7674",,,
23/03/2004,15.00.00,,1112.0,136.0,,980.0,131.0,924.0,99.0,1589.0,900.0,"14,1","49,8","0,7971",,,
23/03/2004,16.00.00,2.0,1132.0,118.0,,927.0,128.0,944.0,100.0,1570.0,781.0,"12,0","61,1","0,8537",,,
23/03/2004,17.00.00,3.0,1225.0,276.0,,1111.0,176.0,818.0,122.0,1719.0,1013.0,"13,6","54,6","0,8465",,,
23/03/2004,18.00.00,,1065.0,151.0,,953.0,107.0,962.0,97.0,1514.0,790.0,"13,7","49,5","0,7695",,,
23/03/2004,19.00.00,,1236.0,236.0,,1084.0,131.0,854.0,112.0,1688.0,1059.0,"11,7","57,1","0,7822",,,
23/03/2004,20.00.00,,1309.0,220.0,,1126.0,166.0,812.0,128.0,1722.0,1205.0,"11,5","58,2","0,7867",,,
23/03/2004,21.00.00,,1089.0,87.0,,884.0,89.0,1006.0,101.0,1487.0,975.0,"12,6","54,2","0,7881",,,
23/03/2004,22.00.00,,1000.0,81.0,,776.0,81.0,1141.0,96.0,1375.0,896.0,"12,0","54,9","0,7664",,,
23/03/2004,23.00.00,,1041.0,74.0,,782.0,78.0,1105.0,86.0,1425.0,911.0,"11,0","61,4","0,8057",,,
24/03/2004,00.00.00,,1045.0,55.0,,756.0,70.0,1137.0,85.0,1411.0,902.0,"11,1","62,2","0,8199",,,
24/03/2004,01.00.00,,997.0,74.0,,744.0,76.0,1151.0,79.0,1405.0,832.0,"10,8","62,5","0,8082",,,
24/03/2004,02.00.00,,948.0,35.0,,634.0,43.0,1320.0,61.0,1326.0,715.0,"11,3","60,0","0,8025",,,
24/03/2004,03.00.00,,878.0,29.0,,551.0,,1493.0,,1272.0,683.0,"10,6","61,6","0,7856",,,
24/03/2004,04.00.00,-200.0,908.0,29.0,,559.0,44.0,1477.0,66.0,1287.0,721.0,"10,2","62,7","0,7813",,,
24/03/2004,05.00.00,,892.0,20.0,,522.0,34.0,1572.0,54.0,1255.0,648.0,"10,9","58,6","0,7628",,,
24/03/2004,06.00.00,,954.0,32.0,,561.0,43.0,1496.0,57.0,1255.0,612.0,"10,8","57,2","0,7382",,,
24/03/2004,07.00.00,,1045.0,84.0,,751.0,79.0,1186.0,75.0,1403.0,800.0,"10,4","59,2","0,7455",,,
24/03/2004,08.00.00,,1383.0,245.0,,1109.0,174.0,832.0,97.0,1706.0,1173.0,"11,0","57,3","0,7501",,,
24/03/2004,09.00.00,,1597.0,553.0,,1395.0,235.0,652.0,110.0,2080.0,1519.0,"11,2","56,9","0,7565",,,
24/03/2004,10.00.00,,1318.0,450.0,,1124.0,218.0,762.0,113.0,1770.0,1287.0,"12,1","54,9","0,7734",,,
24/03/2004,11.00.00,,1138.0,118.0,,898.0,136.0,950.0,88.0,1505.0,966.0,"15,1","44,3","0,7535",,,
24/03/2004,12.00.00,,1098.0,118.0,,842.0,117.0,1012.0,85.0,1440.0,828.0,"15,6","40,6","0,7146",,,
24/03/2004,13.00.00,,1118.0,144.0,,927.0,119.0,959.0,96.0,1477.0,825.0,"16,9","34,6","0,6597",,,
24/03/2004,14.00.00,,1170.0,159.0,,1009.0,126.0,879.0,106.0,1566.0,872.0,"16,6","35,6","0,6697",,,
24/03/2004,15.00.00,-200.0,1112.0,122.0,,842.0,100.0,1015.0,91.0,1494.0,680.0,"11,3","63,9","0,8554",,,
24/03/2004,16.00.00,,1390.0,230.0,,1028.0,197.0,829.0,126.0,1730.0,1002.0,"9,6","81,1","0,9720",,,
24/03/2004,17.00.00,,1353.0,320.0,,1096.0,195.0,774.0,130.0,1783.0,1159.0,"11,7","69,1","0,9497",,,
24/03/2004,18.00.00,,1260.0,263.0,,1050.0,156.0,828.0,111.0,1722.0,979.0,"10,7","68,5","0,8794",,,
24/03/2004,19.00.00,,1501.0,556.0,,1302.0,247.0,681.0,134.0,2008.0,1311.0,"10,7","67,3","0,8643",,,
24/03/2004,20.00.00,,1273.0,458.0,,1130.0,190.0,795.0,136.0,1744.0,1071.0,"10,8","65,7","0,8486",,,
24/03/2004,21.00.00,,1179.0,214.0,,955.0,169.0,928.0,125.0,1571.0,899.0,"10,3","66,3","0,8336",,,
24/03/2004,22.00.00,,1047.0,97.0,,809.0,118.0,1064.0,108.0,1435.0,766.0,"10,1","66,9","0,8248",,,
24/03/2004,23.00.00,,973.0,79.0,,739.0,81.0,1186.0,87.0,1354.0,589.0,"10,4","61,1","0,7717",,,
25/03/2004,00.00.00,,997.0,81.0,,737.0,80.0,1168.0,89.0,1341.0,631.0,"10,3","59,9","0,7516",,,
25/03/2004,01.00.00,1.0,970.0,52.0,,621.0,42.0,1400.0,58.0,1249.0,479.0,"11,0","58,4","0,7686",,,
25/03/2004,02.00.00,,902.0,38.0,,568.0,38.0,1450.0,54.0,1253.0,479.0,"9,1","68,1","0,7890",,,
25/03/2004,03.00.00,,921.0,35.0,,538.0,,1564.0,,1224.0,417.0,"9,5","68,2","0,8091",,,
25/03/2004,04.00.00,,858.0,29.0,,490.0,18.0,1707.0,28.0,1212.0,378.0,"9,3","72,3","0,8496",,,
25/03/2004,05.00.00,,878.0,21.0,,457.0,12.0,1935.0,20.0,1158.0,344.0,"9,9","66,8","0,8152",,,
25/03/2004,06.00.00,,893.0,46.0,,540.0,43.0,1604.0,51.0,1268.0,413.0,"7,6","83,2","0,8695",,,
25/03/2004,07.00.00,,1038.0,55.0,,697.0,84.0,1260.0,82.0,1383.0,605.0,"8,1","79,0","0,8544",,,
25/03/2004,08.00.00,,1320.0,271.0,,1035.0,184.0,902.0,112.0,1721.0,991.0,"8,7","74,6","0,8429",,,
25/03/2004,09.00.00,,1353.0,434.0,,1235.0,202.0,740.0,119.0,1937.0,1175.0,"8,6","75,1","0,8415",,,
25/03/2004,10.00.00,,1133.0,300.0,,933.0,133.0,969.0,99.0,1552.0,923.0,"9,7","69,7","0,8389",,,
25/03/2004,11.00.00,,1066.0,116.0,,849.0,130.0,1039.0,98.0,1468.0,829.0,"11,0","64,4","0,8447",,,
25/03/2004,12.00.00,,1027.0,95.0,,809.0,106.0,1081.0,88.0,1442.0,733.0,"13,6","53,0","0,8209",,,
25/03/2004,13.00.00,2.0,1106.0,211.0,,935.0,132.0,958.0,96.0,1570.0,819.0,"14,2","48,4","0,7780",,,
25/03/2004,14.00.00,,1038.0,168.0,,907.0,106.0,976.0,81.0,1492.0,723.0,"14,2","46,3","0,7438",,,
25/03/2004,15.00.00,,1084.0,154.0,,924.0,125.0,986.0,92.0,1501.0,786.0,"16,0","41,3","0,7462",,,
25/03/2004,16.00.00,,1105.0,267.0,,982.0,138.0,939.0,105.0,1545.0,850.0,"17,7","35,4","0,7094",,,
25/03/2004,17.00.00,2.0,1102.0,143.0,,957.0,120.0,968.0,88.0,1527.0,820.0,"17,1","37,4","0,7225",,,
25/03/2004,18.00.00,,1240.0,374.0,,1137.0,158.0,836.0,103.0,1748.0,991.0,"14,9","40,5","0,6835",,,
25/03/2004,19.00.00,,1443.0,797.0,,1418.0,253.0,666.0,141.0,2060.0,1454.0,"13,4","47,8","0,7293",,,
25/03/2004,20.00.00,,1389.0,698.0,,1341.0,231.0,692.0,133.0,1982.0,1488.0,"12,6","52,5","0,7642",,,
25/03/2004,21.00.00,,1183.0,234.0,,989.0,150.0,904.0,119.0,1539.0,1205.0,"12,2","53,2","0,7555",,,
25/03/2004,22.00.00,,1014.0,104.0,,798.0,99.0,1083.0,106.0,1376.0,909.0,"10,6","56,1","0,7140",,,
25/03/2004,23.00.00,,979.0,67.0,,736.0,75.0,1154.0,92.0,1324.0,769.0,"9,9","59,5","0,7276",,,
26/03/2004,00.00.00,,1048.0,88.0,,787.0,93.0,1098.0,97.0,1373.0,835.0,"9,6","61,1","0,7323",,,
26/03/2004,01.00.00,,1024.0,79.0,,753.0,79.0,1131.0,91.0,1357.0,793.0,"9,7","61,6","0,7425",,,
26/03/2004,02.00.00,,974.0,61.0,,690.0,67.0,1208.0,83.0,1313.0,733.0,"9,4","62,6","0,7398",,,
26/03/2004,03.00.00,,862.0,43.0,,561.0,,1449.0,,1219.0,502.0,"8,2","68,5","0,7455",,,
26/03/2004,04.00.00,,925.0,40.0,,602.0,45.0,1398.0,59.0,1263.0,562.0,"8,0","69,4","0,7459",,,
26/03/2004,05.00.00,,952.0,52.0,,654.0,72.0,1210.0,73.0,1312.0,832.0,"7,7","72,4","0,7655",,,
26/03/2004,06.00.00,,1005.0,64.0,,713.0,103.0,1130.0,78.0,1363.0,924.0,"8,0","71,8","0,7711",,,
26/03/2004,07.00.00,,1122.0,88.0,,842.0,132.0,1015.0,90.0,1438.0,974.0,"8,5","66,3","0,7375",,,
26/03/2004,08.00.00,,1351.0,375.0,,1201.0,239.0,783.0,110.0,1828.0,1307.0,"9,8","59,6","0,7214",,,
26/03/2004,09.00.00,,1408.0,592.0,,1278.0,275.0,682.0,114.0,1928.0,1481.0,"11,2","57,0","0,7544",,,
26/03/2004,10.00.00,,1304.0,357.0,,1142.0,232.0,772.0,119.0,1747.0,1405.0,"14,8","44,1","0,7407",,,
26/03/2004,11.00.00,,1207.0,296.0,,1098.0,180.0,826.0,121.0,1664.0,1195.0,"16,8","35,3","0,6729",,,
26/03/2004,12.00.00,2.0,1099.0,181.0,,1014.0,112.0,948.0,97.0,1503.0,868.0,"19,2","27,1","0,5976",,,
26/03/2004,13.00.00,,1106.0,211.0,,1068.0,116.0,915.0,99.0,1535.0,874.0,"19,1","26,2","0,5741",,,
26/03/2004,14.00.00,,1009.0,199.0,,916.0,103.0,1015.0,85.0,1391.0,738.0,"16,3","30,8","0,5683",,,
26/03/2004,15.00.00,,962.0,81.0,,776.0,89.0,1152.0,75.0,1279.0,550.0,"14,2","36,8","0,5922",,,
26/03/2004,16.00.00,,1093.0,143.0,,933.0,112.0,976.0,87.0,1454.0,777.0,"13,4","41,0","0,6292",,,
26/03/2004,17.00.00,,1180.0,247.0,,1023.0,127.0,886.0,102.0,1588.0,966.0,"14,2","43,3","0,6982",,,
26/03/2004,18.00.00,,1168.0,239.0,,1037.0,125.0,868.0,105.0,1580.0,990.0,"12,1","45,6","0,6403",,,
26/03/2004,19.00.00,,1168.0,267.0,,1063.0,120.0,876.0,98.0,1540.0,944.0,"10,4","48,0","0,6046",,,
26/03/2004,20.00.00,,1140.0,261.0,,1000.0,120.0,916.0,93.0,1490.0,962.0,"10,0","51,1","0,6280",,,
26/03/2004,21.00.00,,1001.0,97.0,,811.0,99.0,1097.0,91.0,1308.0,778.0,"9,8","50,8","0,6172",,,
26/03/2004,22.00.00,,953.0,66.0,,743.0,79.0,1185.0,85.0,1252.0,690.0,"9,7","50,4","0,6063",,,
26/03/2004,23.00.00,,972.0,60.0,,715.0,66.0,1237.0,74.0,1258.0,644.0,"9,9","50,2","0,6103",,,
27/03/2004,00.00.00,,1021.0,77.0,,776.0,94.0,1144.0,87.0,1307.0,753.0,"9,4","53,4","0,6300",,,
27/03/2004,01.00.00,1.0,940.0,57.0,,664.0,70.0,1290.0,79.0,1232.0,646.0,"8,6","57,8","0,6488",,,
27/03/2004,02.00.00,,1046.0,65.0,,736.0,75.0,1142.0,78.0,1312.0,838.0,"8,1","62,1","0,6746",,,
27/03/2004,03.00.00,,1026.0,59.0,,699.0,,1191.0,,1292.0,851.0,"7,9","63,5","0,6777",,,
27/03/2004,04.00.00,-200.0,983.0,48.0,,698.0,57.0,1209.0,63.0,1296.0,801.0,"7,4","64,8","0,6683",,,
27/03/2004,05.00.00,,915.0,27.0,,578.0,32.0,1417.0,48.0,1212.0,665.0,"8,2","58,9","0,6444",,,
27/03/2004,06.00.00,,935.0,25.0,,615.0,54.0,1373.0,59.0,1250.0,717.0,"6,3","66,6","0,6410",,,
27/03/2004,07.00.00,,976.0,42.0,,669.0,68.0,1270.0,65.0,1266.0,795.0,"7,2","62,9","0,6396",,,
27/03/2004,08.00.00,,1124.0,78.0,,842.0,98.0,1050.0,71.0,1418.0,936.0,"7,2","63,9","0,6500",,,
27/03/2004,09.00.00,,1163.0,128.0,,919.0,128.0,922.0,84.0,1530.0,1076.0,"11,1","50,5","0,6654",,,
27/03/2004,10.00.00,,1167.0,184.0,,966.0,129.0,942.0,93.0,1520.0,1016.0,"15,5","36,1","0,6313",,,
27/03/2004,11.00.00,,1121.0,156.0,,955.0,130.0,992.0,99.0,1451.0,834.0,"17,8","29,2","0,5920",,,
27/03/2004,12.00.00,,1071.0,176.0,,940.0,111.0,994.0,93.0,1449.0,756.0,"17,6","30,1","0,6013",,,
27/03/2004,13.00.00,,1065.0,232.0,,979.0,106.0,950.0,96.0,1467.0,766.0,"19,1","26,8","0,5861",,,
27/03/2004,14.00.00,,1157.0,305.0,,1072.0,137.0,888.0,114.0,1596.0,905.0,"17,7","28,6","0,5735",,,
27/03/2004,15.00.00,,1046.0,150.0,,883.0,113.0,1051.0,101.0,1357.0,765.0,"17,8","28,4","0,5737",,,
27/03/2004,16.00.00,,1147.0,188.0,,1042.0,122.0,934.0,108.0,1538.0,830.0,"18,7","26,0","0,5555",,,
27/03/2004,17.00.00,,1119.0,221.0,,1022.0,137.0,916.0,117.0,1508.0,853.0,"17,1","31,3","0,6038",,,
27/03/2004,18.00.00,,1210.0,219.0,,1062.0,165.0,886.0,125.0,1586.0,981.0,"15,8","36,1","0,6440",,,
27/03/2004,19.00.00,3.0,1306.0,306.0,,1079.0,196.0,827.0,133.0,1621.0,1286.0,"14,7","40,1","0,6657",,,
27/03/2004,20.00.00,,1258.0,270.0,,1057.0,174.0,841.0,119.0,1633.0,1244.0,"13,6","44,9","0,6991",,,
27/03/2004,21.00.00,,1148.0,231.0,,930.0,140.0,948.0,107.0,1475.0,1056.0,"12,5","48,1","0,6946",,,
27/03/2004,22.00.00,,1108.0,125.0,,848.0,102.0,1023.0,96.0,1421.0,1003.0,"11,8","50,8","0,7042",,,
27/03/2004,23.00.00,,1231.0,122.0,,924.0,130.0,906.0,105.0,1483.0,1245.0,"10,9","56,1","0,7326",,,
28/03/2004,00.00.00,,1293.0,161.0,,937.0,121.0,930.0,102.0,1464.0,1200.0,"10,9","55,9","0,7277",,,
28/03/2004,01.00.00,,1274.0,101.0,,912.0,111.0,939.0,97.0,1451.0,1188.0,"10,3","58,1","0,7278",,,
28/03/2004,02.00.00,,1135.0,95.0,,827.0,87.0,1013.0,79.0,1395.0,1070.0,"9,3","62,2","0,7294",,,
28/03/2004,03.00.00,,1151.0,129.0,,911.0,,935.0,,1501.0,1075.0,"8,2","66,7","0,7276",,,
28/03/2004,04.00.00,,1010.0,96.0,,769.0,77.0,1110.0,69.0,1396.0,895.0,"8,3","64,9","0,7124",,,
28/03/2004,05.00.00,,870.0,54.0,,626.0,39.0,1325.0,52.0,1284.0,755.0,"9,6","58,5","0,7000",,,
28/03/2004,06.00.00,,983.0,63.0,,688.0,77.0,1251.0,62.0,1342.0,806.0,"7,7","66,4","0,6990",,,
28/03/2004,07.00.00,,995.0,72.0,,691.0,91.0,1219.0,69.0,1321.0,836.0,"7,4","68,0","0,7043",,,
28/03/2004,08.00.00,,1024.0,91.0,,747.0,105.0,1136.0,75.0,1382.0,897.0,"9,7","58,6","0,7035",,,
28/03/2004,09.00.00,,1163.0,127.0,,880.0,133.0,959.0,83.0,1486.0,1073.0,"12,5","50,1","0,7242",,,
28/03/2004,10.00.00,,1218.0,193.0,,938.0,128.0,918.0,94.0,1501.0,1088.0,"16,8","36,9","0,7018",,,
28/03/2004,11.00.00,,1210.0,188.0,,958.0,126.0,933.0,96.0,1514.0,1036.0,"19,2","31,3","0,6887",,,
28/03/2004,12.00.00,,1114.0,151.0,,887.0,92.0,1020.0,86.0,1438.0,768.0,"21,3","26,4","0,6607",,,
28/03/2004,13.00.00,,995.0,103.0,,796.0,66.0,1159.0,72.0,1287.0,587.0,"21,2","23,1","0,5768",,,
28/03/2004,14.00.00,1.0,927.0,55.0,,700.0,50.0,1285.0,53.0,1189.0,452.0,"18,6","25,0","0,5319",,,
28/03/2004,15.00.00,,1002.0,104.0,,754.0,70.0,1189.0,65.0,1260.0,470.0,"18,0","27,3","0,5594",,,
28/03/2004,16.00.00,,987.0,116.0,,727.0,73.0,1213.0,70.0,1244.0,502.0,"18,2","28,3","0,5848",,,
28/03/2004,17.00.00,,993.0,93.0,,714.0,77.0,1217.0,75.0,1238.0,516.0,"17,0","31,4","0,6048",,,
28/03/2004,18.00.00,,1012.0,93.0,,746.0,86.0,1174.0,86.0,1301.0,555.0,"15,6","35,0","0,6170",,,
28/03/2004,19.00.00,,1114.0,155.0,,823.0,93.0,1068.0,94.0,1357.0,671.0,"14,1","40,2","0,6438",,,
28/03/2004,20.00.00,,1093.0,115.0,,789.0,105.0,1102.0,103.0,1329.0,788.0,"13,4","43,2","0,6623",,,
28/03/2004,21.00.00,,968.0,75.0,,669.0,67.0,1261.0,81.0,1246.0,538.0,"12,3","46,8","0,6686",,,
28/03/2004,22.00.00,,960.0,65.0,,666.0,63.0,1266.0,80.0,1224.0,544.0,"11,9","46,5","0,6449",,,
28/03/2004,23.00.00,,942.0,57.0,,648.0,63.0,1300.0,77.0,1204.0,500.0,"11,5","46,6","0,6319",,,
29/03/2004,00.00.00,,888.0,40.0,,598.0,46.0,1396.0,58.0,1156.0,417.0,"10,6","48,0","0,6135",,,
29/03/2004,01.00.00,,818.0,27.0,,524.0,21.0,1588.0,31.0,1071.0,341.0,"10,7","45,8","0,5895",,,
29/03/2004,02.00.00,,840.0,23.0,,509.0,22.0,1643.0,38.0,1076.0,352.0,"10,4","46,6","0,5901",,,
29/03/2004,03.00.00,,894.0,28.0,,524.0,,1557.0,,1095.0,397.0,"10,1","47,8","0,5913",,,
29/03/2004,04.00.00,,864.0,21.0,,516.0,39.0,1496.0,59.0,1153.0,502.0,"11,3","46,9","0,6280",,,
29/03/2004,05.00.00,,898.0,33.0,,559.0,55.0,1441.0,70.0,1180.0,648.0,"10,1","51,2","0,6341",,,
29/03/2004,06.00.00,,946.0,40.0,,643.0,76.0,1309.0,75.0,1232.0,760.0,"9,9","50,7","0,6167",,,
29/03/2004,07.00.00,,1309.0,279.0,,1125.0,181.0,844.0,103.0,1687.0,1183.0,"8,1","56,8","0,6150",,,
29/03/2004,08.00.00,,1326.0,743.0,,1289.0,259.0,714.0,134.0,1806.0,1431.0,"10,9","44,1","0,5748",,,
29/03/2004,09.00.00,,966.0,147.0,,786.0,118.0,1111.0,98.0,1258.0,705.0,"11,8","37,6","0,5184",,,
29/03/2004,10.00.00,,975.0,97.0,,793.0,119.0,1133.0,97.0,1254.0,637.0,"13,9","33,2","0,5222",,,
29/03/2004,11.00.00,,988.0,118.0,,803.0,123.0,1105.0,98.0,1293.0,658.0,"15,6","30,1","0,5285",,,
29/03/2004,12.00.00,,971.0,91.0,,786.0,92.0,1129.0,78.0,1272.0,546.0,"16,5","29,0","0,5406",,,
29/03/2004,13.00.00,,1010.0,146.0,,833.0,91.0,1070.0,83.0,1332.0,561.0,"17,5","27,9","0,5517",,,
29/03/2004,14.00.00,,984.0,139.0,,790.0,103.0,1131.0,92.0,1268.0,532.0,"17,9","26,8","0,5446",,,
29/03/2004,15.00.00,,962.0,155.0,,776.0,102.0,1131.0,81.0,1247.0,535.0,"18,2","26,1","0,5387",,,
29/03/2004,16.00.00,,1012.0,128.0,,801.0,94.0,1098.0,90.0,1289.0,525.0,"18,0","27,1","0,5522",,,
29/03/2004,17.00.00,,1058.0,166.0,,896.0,98.0,996.0,95.0,1358.0,603.0,"17,0","28,9","0,5558",,,
29/03/2004,18.00.00,,1173.0,299.0,,985.0,126.0,905.0,114.0,1477.0,802.0,"16,1","31,3","0,5680",,,
29/03/2004,19.00.00,,1127.0,163.0,,907.0,108.0,957.0,106.0,1404.0,796.0,"14,5","35,4","0,5839",,,
29/03/2004,20.00.00,,1020.0,154.0,,797.0,95.0,1066.0,99.0,1302.0,689.0,"13,2","37,9","0,5733",,,
29/03/2004,21.00.00,,949.0,80.0,,700.0,78.0,1221.0,90.0,1178.0,553.0,"13,1","34,4","0,5170",,,
29/03/2004,22.00.00,,930.0,58.0,,710.0,61.0,1278.0,82.0,1137.0,509.0,"13,5","28,5","0,4405",,,
29/03/2004,23.00.00,1.0,900.0,55.0,,643.0,55.0,1339.0,74.0,1089.0,455.0,"12,4","31,9","0,4583",,,
30/03/2004,00.00.00,1.0,899.0,33.0,,630.0,57.0,1418.0,76.0,1050.0,425.0,"13,1","26,8","0,4023",,,
30/03/2004,01.00.00,,866.0,33.0,,569.0,41.0,1468.0,66.0,1055.0,436.0,"11,6","33,6","0,4595",,,
30/03/2004,02.00.00,,900.0,32.0,,563.0,46.0,1402.0,73.0,1130.0,618.0,"10,5","42,9","0,5442",,,
30/03/2004,03.00.00,,949.0,25.0,,540.0,,1457.0,,1104.0,747.0,"11,7","38,7","0,5298",,,
30/03/2004,04.00.00,-200.0,897.0,29.0,,529.0,41.0,1462.0,69.0,1101.0,693.0,"12,2","37,2","0,5277",,,
30/03/2004,05.00.00,,956.0,26.0,,605.0,52.0,1341.0,71.0,1117.0,691.0,"12,9","33,9","0,5037",,,
30/03/2004,06.00.00,,1054.0,86.0,,779.0,111.0,1080.0,98.0,1266.0,1013.0,"11,3","40,3","0,5376",,,
30/03/2004,07.00.00,,1343.0,294.0,,1096.0,191.0,839.0,115.0,1587.0,1311.0,"11,9","38,4","0,5341",,,
30/03/2004,08.00.00,4.0,1584.0,664.0,,1399.0,244.0,642.0,130.0,1947.0,1675.0,"13,3","35,6","0,5416",,,
30/03/2004,09.00.00,,1556.0,695.0,,1337.0,283.0,674.0,150.0,1852.0,1689.0,"16,3","28,8","0,5305",,,
30/03/2004,10.00.00,,1565.0,735.0,,1324.0,320.0,695.0,159.0,1872.0,1688.0,"17,9","28,2","0,5741",,,
30/03/2004,11.00.00,,1429.0,649.0,,1251.0,249.0,734.0,146.0,1754.0,1548.0,"18,3","26,6","0,5529",,,
30/03/2004,12.00.00,,1419.0,586.0,,1267.0,219.0,742.0,138.0,1763.0,1490.0,"20,8","22,5","0,5463",,,
30/03/2004,13.00.00,,1373.0,546.0,,1213.0,200.0,791.0,128.0,1711.0,1354.0,"22,4","20,0","0,5352",,,
30/03/2004,14.00.00,,1185.0,245.0,,992.0,138.0,942.0,97.0,1448.0,1014.0,"20,9","21,7","0,5295",,,
30/03/2004,15.00.00,,1122.0,178.0,,897.0,118.0,991.0,91.0,1372.0,831.0,"19,1","26,5","0,5790",,,
30/03/2004,16.00.00,,1085.0,130.0,,820.0,99.0,1060.0,81.0,1325.0,699.0,"18,1","30,6","0,6295",,,
30/03/2004,17.00.00,,1249.0,151.0,,968.0,112.0,874.0,99.0,1527.0,926.0,"17,3","34,7","0,6788",,,
30/03/2004,18.00.00,,1236.0,272.0,,962.0,117.0,853.0,101.0,1532.0,928.0,"15,8","40,4","0,7228",,,
30/03/2004,19.00.00,,1334.0,301.0,,1047.0,129.0,815.0,106.0,1638.0,1038.0,"15,9","42,0","0,7541",,,
30/03/2004,20.00.00,,1264.0,237.0,,928.0,132.0,884.0,102.0,1534.0,1035.0,"15,9","43,5","0,7790",,,
30/03/2004,21.00.00,,1073.0,95.0,,746.0,73.0,1072.0,84.0,1360.0,789.0,"15,0","46,1","0,7833",,,
30/03/2004,22.00.00,,1053.0,68.0,,701.0,68.0,1147.0,81.0,1323.0,692.0,"15,1","44,6","0,7574",,,
30/03/2004,23.00.00,,1098.0,101.0,,747.0,80.0,1094.0,91.0,1360.0,764.0,"14,9","43,5","0,7302",,,
31/03/2004,00.00.00,,1029.0,81.0,,702.0,68.0,1180.0,82.0,1287.0,639.0,"14,8","41,0","0,6850",,,
31/03/2004,01.00.00,1.0,973.0,50.0,,631.0,44.0,1287.0,64.0,1240.0,541.0,"14,8","40,8","0,6814",,,
31/03/2004,02.00.00,,972.0,66.0,,639.0,47.0,1222.0,70.0,1256.0,678.0,"14,8","40,8","0,6834",,,
31/03/2004,03.00.00,,832.0,22.0,,496.0,,1613.0,,1066.0,381.0,"14,2","36,1","0,5823",,,
31/03/2004,04.00.00,,851.0,18.0,,477.0,15.0,1699.0,26.0,1064.0,343.0,"14,5","36,1","0,5928",,,
31/03/2004,05.00.00,,909.0,31.0,,545.0,44.0,1473.0,58.0,1131.0,436.0,"14,6","36,0","0,5947",,,
31/03/2004,06.00.00,1.0,1038.0,57.0,,684.0,85.0,1220.0,93.0,1279.0,688.0,"14,4","38,5","0,6291",,,
31/03/2004,07.00.00,,1636.0,342.0,,1168.0,207.0,721.0,110.0,1926.0,1438.0,"13,8","58,2","0,9129",,,
31/03/2004,08.00.00,,1580.0,644.0,,1295.0,230.0,639.0,115.0,1957.0,1489.0,"13,2","61,1","0,9256",,,
31/03/2004,09.00.00,,1262.0,216.0,,924.0,181.0,872.0,125.0,1576.0,1093.0,"10,4","74,4","0,9384",,,
31/03/2004,10.00.00,,1197.0,117.0,,837.0,144.0,957.0,118.0,1498.0,965.0,"11,5","71,0","0,9582",,,
31/03/2004,11.00.00,,1277.0,156.0,,886.0,140.0,902.0,109.0,1579.0,1004.0,"12,2","70,0","0,9924",,,
31/03/2004,12.00.00,,1430.0,332.0,,1025.0,204.0,779.0,123.0,1772.0,1166.0,"12,3","73,3","1,0442",,,
31/03/2004,13.00.00,,1242.0,232.0,,944.0,149.0,846.0,114.0,1638.0,991.0,"11,3","78,1","1,0411",,,
31/03/2004,14.00.00,,1349.0,295.0,,1023.0,171.0,804.0,114.0,1748.0,1054.0,"13,6","69,2","1,0746",,,
31/03/2004,15.00.00,,1390.0,386.0,,1100.0,195.0,755.0,119.0,1799.0,1192.0,"14,9","59,3","0,9974",,,
31/03/2004,16.00.00,,1224.0,278.0,,980.0,152.0,850.0,111.0,1637.0,1055.0,"15,7","50,9","0,8997",,,
31/03/2004,17.00.00,,1253.0,263.0,,1026.0,128.0,810.0,103.0,1681.0,1048.0,"15,2","52,9","0,9087",,,
31/03/2004,18.00.00,,1312.0,322.0,,1041.0,121.0,821.0,103.0,1712.0,1073.0,"15,5","50,8","0,8881",,,
31/03/2004,19.00.00,,1254.0,226.0,,1033.0,142.0,819.0,107.0,1669.0,1068.0,"14,3","52,9","0,8581",,,
31/03/2004,20.00.00,,1198.0,221.0,,953.0,131.0,882.0,105.0,1588.0,1019.0,"13,2","56,0","0,8446",,,
31/03/2004,21.00.00,,1060.0,109.0,,787.0,81.0,1044.0,91.0,1418.0,833.0,"12,6","57,0","0,8315",,,
31/03/2004,22.00.00,,1050.0,105.0,,769.0,60.0,1078.0,79.0,1409.0,759.0,"12,3","57,8","0,8224",,,
31/03/2004,23.00.00,,1029.0,84.0,,754.0,57.0,1098.0,79.0,1395.0,749.0,"12,0","58,4","0,8164",,,
01/04/2004,00.00.00,,1143.0,106.0,,825.0,96.0,986.0,86.0,1477.0,978.0,"12,0","61,6","0,8593",,,2004-01-04
01/04/2004,01.00.00,,1044.0,100.0,,770.0,85.0,1031.0,70.0,1425.0,944.0,"11,5","63,9","0,8652",,,2004-01-04
01/04/2004,02.00.00,,1034.0,71.0,,716.0,50.0,1085.0,55.0,1405.0,891.0,"10,7","67,2","0,8630",,,2004-01-04
01/04/2004,03.00.00,,956.0,72.0,,713.0,,1099.0,,1422.0,849.0,"9,0","73,1","0,8394",,,2004-01-04
01/04/2004,04.00.00,,909.0,44.0,,615.0,57.0,1237.0,49.0,1322.0,790.0,"10,2","66,6","0,8299",,,2004-01-04
01/04/2004,05.00.00,,996.0,45.0,,648.0,64.0,1176.0,50.0,1340.0,852.0,"11,0","63,7","0,8325",,,2004-01-04
01/04/2004,06.00.00,,1154.0,134.0,,876.0,153.0,1002.0,67.0,1561.0,987.0,"9,6","68,8","0,8243",,,2004-01-04
01/04/2004,07.00.00,,1510.0,505.0,,1291.0,342.0,675.0,94.0,1949.0,1435.0,"9,5","69,6","0,8273",,,2004-01-04
01/04/2004,08.00.00,,1722.0,1042.0,,1595.0,378.0,539.0,119.0,2439.0,1798.0,"11,9","60,9","0,8455",,,2004-01-04
01/04/2004,09.00.00,,1512.0,737.0,,1323.0,304.0,631.0,139.0,2001.0,1677.0,"16,2","48,6","0,8892",,,2004-01-04
01/04/2004,10.00.00,,1258.0,375.0,,1040.0,192.0,800.0,113.0,1701.0,1282.0,"19,2","39,6","0,8693",,,2004-01-04
01/04/2004,11.00.00,,1094.0,124.0,,850.0,130.0,970.0,88.0,1489.0,871.0,"19,7","38,4","0,8743",,,2004-01-04
01/04/2004,12.00.00,,1129.0,137.0,,875.0,106.0,974.0,73.0,1524.0,759.0,"20,6","36,7","0,8797",,,2004-01-04
01/04/2004,13.00.00,,1125.0,179.0,,924.0,102.0,937.0,73.0,1542.0,790.0,"21,8","33,9","0,8771",,,2004-01-04
01/04/2004,14.00.00,,,222.0,,,99.0,,72.0,,,-200,-200,-200,,,2004-01-04
01/04/2004,15.00.00,,,197.0,,,108.0,,81.0,,,-200,-200,-200,,,2004-01-04
01/04/2004,16.00.00,,,319.0,,,131.0,,93.0,,,-200,-200,-200,,,2004-01-04
01/04/2004,17.00.00,,1308.0,388.0,,1193.0,163.0,793.0,106.0,1193.0,1187.0,"23,6","27,5","0,7913",,,2004-01-04
01/04/2004,18.00.00,,1529.0,589.0,,1331.0,211.0,700.0,132.0,2028.0,1399.0,"22,8","32,1","0,8814",,,2004-01-04
01/04/2004,19.00.00,,1592.0,840.0,,1429.0,267.0,624.0,164.0,2089.0,1644.0,"20,8","36,7","0,8878",,,2004-01-04
01/04/2004,20.00.00,,1536.0,655.0,,1302.0,269.0,666.0,161.0,1922.0,1599.0,"18,3","40,9","0,8493",,,2004-01-04
01/04/2004,21.00.00,,1192.0,254.0,,1007.0,154.0,827.0,124.0,1604.0,1223.0,"16,8","44,0","0,8341",,,2004-01-04
01/04/2004,22.00.00,2.0,1186.0,188.0,,976.0,127.0,844.0,113.0,1570.0,1200.0,"15,8","48,0","0,8569",,,2004-01-04
01/04/2004,23.00.00,2.0,1203.0,120.0,,920.0,122.0,898.0,103.0,1529.0,1118.0,"14,9","52,0","0,8757",,,2004-01-04
02/04/2004,00.00.00,2.0,1139.0,157.0,,899.0,126.0,921.0,104.0,1514.0,1067.0,"14,1","54,4","0,8701",,,2004-02-04
02/04/2004,01.00.00,,1072.0,88.0,,795.0,84.0,986.0,93.0,1442.0,1048.0,"13,3","58,8","0,8922",,,2004-02-04
02/04/2004,02.00.00,1.0,954.0,68.0,,667.0,58.0,1180.0,60.0,1350.0,718.0,"13,3","60,9","0,9229",,,2004-02-04
02/04/2004,03.00.00,,951.0,57.0,,673.0,,1137.0,,1381.0,797.0,"11,8","64,3","0,8869",,,2004-02-04
02/04/2004,04.00.00,-200.0,926.0,36.0,,638.0,37.0,1195.0,52.0,1342.0,749.0,"11,2","65,9","0,8775",,,2004-02-04
02/04/2004,05.00.00,,968.0,51.0,,628.0,56.0,1197.0,66.0,1372.0,737.0,"11,3","72,9","0,9738",,,2004-02-04
02/04/2004,06.00.00,,1067.0,93.0,,727.0,91.0,1055.0,82.0,1448.0,903.0,"11,4","71,8","0,9671",,,2004-02-04
02/04/2004,07.00.00,,1386.0,284.0,,1083.0,159.0,798.0,109.0,1833.0,1159.0,"11,9","73,7","1,0254",,,2004-02-04
02/04/2004,08.00.00,,1474.0,486.0,,1306.0,190.0,634.0,114.0,2060.0,1365.0,"12,6","70,2","1,0221",,,2004-02-04
02/04/2004,09.00.00,5.0,1569.0,798.0,,1316.0,249.0,634.0,139.0,2054.0,1510.0,"13,6","65,3","1,0136",,,2004-02-04
02/04/2004,10.00.00,,1375.0,524.0,,1177.0,196.0,706.0,127.0,1898.0,1386.0,"16,9","52,3","1,0013",,,2004-02-04
02/04/2004,11.00.00,,1328.0,468.0,,1123.0,180.0,738.0,127.0,1821.0,1368.0,"19,4","44,1","0,9855",,,2004-02-04
02/04/2004,12.00.00,,1341.0,454.0,,1176.0,167.0,748.0,135.0,1825.0,1347.0,"22,9","33,8","0,9322",,,2004-02-04
02/04/2004,13.00.00,3.0,1297.0,461.0,,1183.0,159.0,765.0,130.0,1773.0,1242.0,"23,6","31,3","0,9001",,,2004-02-04
02/04/2004,14.00.00,,1303.0,391.0,,1139.0,152.0,790.0,126.0,1761.0,1138.0,"24,7","30,5","0,9371",,,2004-02-04
02/04/2004,15.00.00,,1281.0,337.0,,1116.0,149.0,809.0,121.0,1703.0,1080.0,"26,1","27,3","0,9101",,,2004-02-04
02/04/2004,16.00.00,,1248.0,297.0,,1103.0,143.0,872.0,122.0,1632.0,1002.0,"27,6","22,8","0,8288",,,2004-02-04
02/04/2004,17.00.00,,1382.0,588.0,,1288.0,185.0,778.0,138.0,1799.0,1212.0,"26,9","22,3","0,7792",,,2004-02-04
02/04/2004,18.00.00,,1491.0,721.0,,1385.0,223.0,685.0,165.0,1915.0,1486.0,"24,3","30,1","0,9012",,,2004-02-04
02/04/2004,19.00.00,,1620.0,710.0,,1407.0,215.0,641.0,154.0,2052.0,1567.0,"21,2","40,1","0,9978",,,2004-02-04
02/04/2004,20.00.00,,1693.0,787.0,,1439.0,271.0,618.0,168.0,2083.0,1723.0,"19,4","42,5","0,9483",,,2004-02-04
02/04/2004,21.00.00,3.0,1374.0,415.0,,1121.0,180.0,771.0,146.0,1685.0,1399.0,"18,5","43,0","0,9074",,,2004-02-04
02/04/2004,22.00.00,,1287.0,245.0,,982.0,115.0,841.0,124.0,1582.0,1291.0,"17,8","47,0","0,9467",,,2004-02-04
02/04/2004,23.00.00,,1408.0,294.0,,1052.0,149.0,761.0,124.0,1684.0,1443.0,"16,8","53,2","1,0100",,,2004-02-04
03/04/2004,00.00.00,,1254.0,139.0,,941.0,98.0,828.0,106.0,1566.0,1270.0,"17,1","51,8","0,9990",,,2004-03-04
03/04/2004,01.00.00,,1141.0,98.0,,827.0,73.0,936.0,88.0,1488.0,1110.0,"16,2","54,2","0,9933",,,2004-03-04
03/04/2004,02.00.00,,1141.0,88.0,,777.0,69.0,986.0,83.0,1455.0,1060.0,"15,1","58,2","0,9886",,,2004-03-04
03/04/2004,03.00.00,,1042.0,66.0,,697.0,,1056.0,,1410.0,965.0,"15,1","57,6","0,9796",,,2004-03-04
03/04/2004,04.00.00,,986.0,57.0,,651.0,60.0,1145.0,74.0,1380.0,891.0,"14,5","58,0","0,9488",,,2004-03-04
03/04/2004,05.00.00,,1005.0,57.0,,673.0,56.0,1103.0,64.0,1387.0,905.0,"13,7","61,6","0,9631",,,2004-03-04
03/04/2004,06.00.00,,1041.0,60.0,,683.0,73.0,1112.0,69.0,1398.0,899.0,"13,9","59,6","0,9408",,,2004-03-04
03/04/2004,07.00.00,2.0,1272.0,200.0,,959.0,159.0,846.0,91.0,1660.0,1136.0,"13,3","61,7","0,9399",,,2004-03-04
03/04/2004,08.00.00,3.0,1436.0,451.0,,1154.0,203.0,704.0,96.0,1872.0,1391.0,"15,1","55,8","0,9486",,,2004-03-04
03/04/2004,09.00.00,,1472.0,422.0,,1126.0,211.0,720.0,106.0,1816.0,1460.0,"17,0","50,5","0,9684",,,2004-03-04
03/04/2004,10.00.00,-200.0,1418.0,,,1023.0,,785.0,,1720.0,1410.0,"19,7","43,3","0,9837",,,2004-03-04
03/04/2004,11.00.00,-200.0,1410.0,,,1030.0,,781.0,,1743.0,1372.0,"20,7","41,7","1,0092",,,2004-03-04
03/04/2004,12.00.00,-200.0,1438.0,,,1096.0,,781.0,,1779.0,1266.0,"23,3","35,8","1,0098",,,2004-03-04
03/04/2004,13.00.00,-200.0,1278.0,,,1000.0,,866.0,,1621.0,1014.0,"23,8","30,5","0,8897",,,2004-03-04
03/04/2004,14.00.00,-200.0,1257.0,,,1006.0,,915.0,,1573.0,870.0,"24,8","27,0","0,8325",,,2004-03-04
03/04/2004,15.00.00,-200.0,1331.0,,,1046.0,,882.0,,1635.0,905.0,"25,0","27,5","0,8575",,,2004-03-04
03/04/2004,16.00.00,-200.0,1361.0,,,1102.0,,834.0,,1704.0,991.0,"25,8","26,5","0,8675",,,2004-03-04
03/04/2004,17.00.00,-200.0,1398.0,,,1156.0,,812.0,,1722.0,1076.0,"25,1","27,1","0,8496",,,2004-03-04
03/04/2004,18.00.00,-200.0,1483.0,,,1213.0,,764.0,,1798.0,1249.0,"23,7","28,6","0,8273",,,2004-03-04
03/04/2004,19.00.00,-200.0,1697.0,,,1471.0,,625.0,,2153.0,1548.0,"22,1","36,8","0,9681",,,2004-03-04
03/04/2004,20.00.00,-200.0,1459.0,,,1124.0,,736.0,,1823.0,1300.0,"19,9","47,5","1,0912",,,2004-03-04
03/04/2004,21.00.00,-200.0,1268.0,,,918.0,,873.0,,1602.0,1029.0,"18,7","50,4","1,0772",,,2004-03-04
03/04/2004,22.00.00,-200.0,1469.0,,,1128.0,,762.0,,1870.0,1207.0,"18,1","51,3","1,0587",,,2004-03-04
03/04/2004,23.00.00,-200.0,1316.0,,,952.0,,847.0,,1644.0,1047.0,"17,5","53,8","1,0648",,,2004-03-04
04/04/2004,00.00.00,-200.0,1224.0,,,892.0,,884.0,,1580.0,923.0,"16,7","56,5","1,0634",,,2004-04-04
04/04/2004,01.00.00,-200.0,1215.0,,,843.0,,929.0,,1551.0,862.0,"15,9","59,2","1,0635",,,2004-04-04
04/04/2004,02.00.00,-200.0,1115.0,,,782.0,,980.0,,1500.0,752.0,"15,2","62,4","1,0726",,,2004-04-04
04/04/2004,03.00.00,-200.0,1124.0,,,793.0,,965.0,,1521.0,791.0,"14,7","65,0","1,0766",,,2004-04-04
04/04/2004,04.00.00,-200.0,1028.0,,,682.0,,1090.0,,1448.0,697.0,"14,3","65,3","1,0594",,,2004-04-04
04/04/2004,05.00.00,-200.0,1010.0,,,650.0,,1171.0,,1434.0,664.0,"13,7","66,5","1,0393",,,2004-04-04
04/04/2004,06.00.00,-200.0,1074.0,,,731.0,,1020.0,,1488.0,891.0,"12,9","69,1","1,0264",,,2004-04-04
04/04/2004,07.00.00,-200.0,1034.0,,,684.0,,1110.0,,1423.0,813.0,"13,7","64,8","1,0135",,,2004-04-04
04/04/2004,08.00.00,-200.0,1130.0,,,720.0,,1063.0,,1461.0,828.0,"15,3","59,0","1,0181",,,2004-04-04
04/04/2004,09.00.00,-200.0,1275.0,,,900.0,,868.0,,1634.0,1057.0,"18,1","49,8","1,0272",,,2004-04-04
04/04/2004,10.00.00,-200.0,1324.0,,,939.0,,846.0,,1658.0,1011.0,"21,5","40,7","1,0301",,,2004-04-04
04/04/2004,11.00.00,-200.0,1268.0,,,902.0,,906.0,,1589.0,932.0,"23,3","37,1","1,0457",,,2004-04-04
04/04/2004,12.00.00,-200.0,1272.0,,,924.0,,895.0,,1603.0,881.0,"25,1","33,8","1,0594",,,2004-04-04
04/04/2004,13.00.00,-200.0,1160.0,,,860.0,,969.0,,1531.0,646.0,"25,6","32,1","1,0393",,,2004-04-04
04/04/2004,14.00.00,-200.0,1136.0,,,792.0,,1057.0,,1476.0,536.0,"25,8","31,1","1,0143",,,2004-04-04
04/04/2004,15.00.00,-200.0,1296.0,,,977.0,,863.0,,1642.0,746.0,"26,1","30,8","1,0253",,,2004-04-04
04/04/2004,16.00.00,-200.0,1345.0,,,996.0,,841.0,,1678.0,833.0,"24,4","36,0","1,0850",,,2004-04-04
04/04/2004,17.00.00,-200.0,1296.0,,,983.0,,845.0,,1626.0,802.0,"23,0","36,2","1,0053",,,2004-04-04
04/04/2004,18.00.00,-200.0,1258.0,,,977.0,,838.0,,1636.0,838.0,"22,1","39,3","1,0336",,,2004-04-04
04/04/2004,19.00.00,-200.0,1420.0,,,1085.0,,755.0,,1756.0,1051.0,"19,8","44,6","1,0208",,,2004-04-04
04/04/2004,20.00.00,-200.0,1366.0,,,997.0,,830.0,,1673.0,1041.0,"18,5","48,9","1,0323",,,2004-04-04
04/04/2004,21.00.00,-200.0,1113.0,,,772.0,,989.0,,1493.0,646.0,"16,6","56,1","1,0481",,,2004-04-04
04/04/2004,22.00.00,-200.0,1196.0,,,853.0,,909.0,,1556.0,769.0,"15,8","58,8","1,0464",,,2004-04-04
04/04/2004,23.00.00,-200.0,1188.0,,,829.0,,930.0,,1540.0,785.0,"15,3","60,8","1,0501",,,2004-04-04
05/04/2004,00.00.00,-200.0,1102.0,,,750.0,,1007.0,,1470.0,613.0,"14,7","64,4","1,0717",,,2004-05-04
05/04/2004,01.00.00,-200.0,969.0,,,611.0,,1239.0,,1330.0,430.0,"14,8","63,3","1,0584",,,2004-05-04
05/04/2004,02.00.00,-200.0,983.0,,,600.0,,1233.0,,1375.0,485.0,"15,0","61,5","1,0418",,,2004-05-04
05/04/2004,03.00.00,-200.0,876.0,,,505.0,,1456.0,,1294.0,467.0,"15,5","56,9","0,9961",,,2004-05-04
05/04/2004,04.00.00,-200.0,884.0,,,489.0,,1536.0,,1278.0,436.0,"16,0","54,0","0,9742",,,2004-05-04
05/04/2004,05.00.00,-200.0,1024.0,,,658.0,,1175.0,,1417.0,682.0,"13,5","63,9","0,9809",,,2004-05-04
05/04/2004,06.00.00,-200.0,1126.0,,,822.0,,945.0,,1541.0,927.0,"12,9","65,3","0,9688",,,2004-05-04
05/04/2004,07.00.00,-200.0,1415.0,,,1089.0,,767.0,,1795.0,1192.0,"13,4","62,5","0,9582",,,2004-05-04
05/04/2004,08.00.00,-200.0,1631.0,,,1449.0,,570.0,,2299.0,1615.0,"14,5","58,8","0,9630",,,2004-05-04
05/04/2004,09.00.00,-200.0,1499.0,,,1247.0,,647.0,,1972.0,1505.0,"15,3","56,7","0,9773",,,2004-05-04
05/04/2004,10.00.00,,1461.0,424.0,,1127.0,236.0,703.0,124.0,1836.0,1451.0,"15,6","57,4","1,0075",,,2004-05-04
05/04/2004,11.00.00,3.0,1430.0,339.0,,1107.0,228.0,713.0,121.0,1853.0,1409.0,"16,6","55,2","1,0382",,,2004-05-04
05/04/2004,12.00.00,,1498.0,445.0,,1171.0,206.0,684.0,114.0,1942.0,1434.0,"17,0","54,3","1,0434",,,2004-05-04
05/04/2004,13.00.00,,1454.0,535.0,,1162.0,188.0,682.0,114.0,1915.0,1457.0,"18,0","51,5","1,0552",,,2004-05-04
05/04/2004,14.00.00,,1402.0,278.0,,1069.0,158.0,733.0,106.0,1793.0,1325.0,"19,5","47,5","1,0653",,,2004-05-04
05/04/2004,15.00.00,,1327.0,256.0,,971.0,124.0,803.0,89.0,1705.0,1120.0,"21,6","41,7","1,0606",,,2004-05-04
05/04/2004,16.00.00,2.0,1273.0,245.0,,963.0,98.0,832.0,82.0,1662.0,931.0,"22,2","38,3","1,0106",,,2004-05-04
05/04/2004,17.00.00,,1457.0,458.0,,1190.0,160.0,678.0,111.0,1877.0,1212.0,"20,3","42,8","1,0053",,,2004-05-04
05/04/2004,18.00.00,,1543.0,710.0,,1290.0,194.0,631.0,132.0,2011.0,1353.0,"19,7","45,4","1,0312",,,2004-05-04
05/04/2004,19.00.00,,1499.0,678.0,,1239.0,174.0,651.0,121.0,1957.0,1359.0,"18,8","47,5","1,0199",,,2004-05-04
05/04/2004,20.00.00,,1378.0,436.0,,1102.0,157.0,742.0,116.0,1796.0,1273.0,"17,9","49,4","1,0064",,,2004-05-04
05/04/2004,21.00.00,2.0,1243.0,178.0,,928.0,109.0,852.0,100.0,1622.0,1079.0,"17,5","50,9","1,0090",,,2004-05-04
05/04/2004,22.00.00,,1196.0,160.0,,885.0,85.0,884.0,89.0,1589.0,973.0,"17,4","51,8","1,0230",,,2004-05-04
05/04/2004,23.00.00,,1137.0,177.0,,869.0,90.0,890.0,92.0,1554.0,951.0,"17,0","53,9","1,0363",,,2004-05-04
06/04/2004,00.00.00,1.0,1015.0,101.0,,718.0,61.0,1065.0,71.0,1428.0,714.0,"16,6","55,4","1,0408",,,2004-06-04
06/04/2004,01.00.00,,978.0,66.0,,635.0,36.0,1188.0,51.0,1382.0,579.0,"15,9","57,0","1,0224",,,2004-06-04
06/04/2004,02.00.00,,933.0,40.0,,547.0,25.0,1357.0,39.0,1336.0,542.0,"15,0","59,2","1,0059",,,2004-06-04
06/04/2004,03.00.00,,927.0,54.0,,579.0,,1267.0,,1370.0,562.0,"14,5","61,4","1,0041",,,2004-06-04
06/04/2004,04.00.00,,908.0,39.0,,569.0,24.0,1303.0,35.0,1360.0,526.0,"14,1","61,6","0,9883",,,2004-06-04
06/04/2004,05.00.00,,980.0,62.0,,677.0,73.0,1141.0,64.0,1435.0,659.0,"14,6","58,8","0,9711",,,2004-06-04
06/04/2004,06.00.00,,1236.0,120.0,,920.0,164.0,880.0,94.0,1641.0,1012.0,"14,4","58,9","0,9594",,,2004-06-04
06/04/2004,07.00.00,,1664.0,599.0,,1407.0,329.0,594.0,134.0,2198.0,1564.0,"15,3","55,2","0,9538",,,2004-06-04
06/04/2004,08.00.00,,1757.0,1084.0,,1636.0,302.0,494.0,129.0,2560.0,1806.0,"16,2","52,5","0,9576",,,2004-06-04
06/04/2004,09.00.00,,1524.0,776.0,,1350.0,256.0,588.0,125.0,2096.0,1604.0,"18,4","46,3","0,9734",,,2004-06-04
06/04/2004,10.00.00,,1329.0,470.0,,1119.0,182.0,707.0,107.0,1823.0,1288.0,"19,6","41,8","0,9407",,,2004-06-04
06/04/2004,11.00.00,,1167.0,169.0,,884.0,105.0,881.0,78.0,1580.0,931.0,"20,2","40,1","0,9370",,,2004-06-04
06/04/2004,12.00.00,,1369.0,304.0,,1132.0,136.0,715.0,91.0,1818.0,1162.0,"20,9","36,6","0,8939",,,2004-06-04
06/04/2004,13.00.00,,1284.0,405.0,,1103.0,167.0,755.0,116.0,1704.0,1064.0,"20,4","34,7","0,8229",,,2004-06-04
06/04/2004,14.00.00,,1221.0,297.0,,1032.0,166.0,811.0,131.0,1630.0,913.0,"19,3","35,4","0,7813",,,2004-06-04
06/04/2004,15.00.00,,1096.0,220.0,,947.0,115.0,872.0,113.0,1519.0,684.0,"18,6","36,9","0,7829",,,2004-06-04
06/04/2004,16.00.00,,1143.0,226.0,,988.0,109.0,849.0,98.0,1590.0,710.0,"18,8","36,8","0,7883",,,2004-06-04
06/04/2004,17.00.00,,1251.0,456.0,,1116.0,143.0,760.0,116.0,1716.0,923.0,"17,5","40,6","0,8068",,,2004-06-04
06/04/2004,18.00.00,3.0,1268.0,470.0,,1148.0,159.0,728.0,120.0,1776.0,1006.0,"16,8","44,3","0,8428",,,2004-06-04
06/04/2004,19.00.00,,1314.0,503.0,,1150.0,181.0,726.0,126.0,1784.0,1083.0,"16,3","47,7","0,8746",,,2004-06-04
06/04/2004,20.00.00,,1315.0,459.0,,1142.0,178.0,724.0,126.0,1807.0,1161.0,"15,6","50,7","0,8947",,,2004-06-04
06/04/2004,21.00.00,,1095.0,227.0,,918.0,91.0,896.0,90.0,1527.0,800.0,"15,7","49,4","0,8768",,,2004-06-04
06/04/2004,22.00.00,,1027.0,152.0,,808.0,76.0,996.0,81.0,1458.0,647.0,"15,8","48,6","0,8653",,,2004-06-04
06/04/2004,23.00.00,,1012.0,94.0,,752.0,66.0,1053.0,74.0,1393.0,649.0,"15,7","47,0","0,8325",,,2004-06-04
07/04/2004,00.00.00,,948.0,93.0,,710.0,56.0,1127.0,67.0,1352.0,575.0,"15,7","45,9","0,8121",,,2004-07-04
07/04/2004,01.00.00,,889.0,49.0,,603.0,35.0,1308.0,46.0,1271.0,455.0,"15,6","44,9","0,7920",,,2004-07-04
07/04/2004,02.00.00,,830.0,30.0,,538.0,21.0,1475.0,30.0,1214.0,392.0,"15,6","44,4","0,7827",,,2004-07-04
07/04/2004,03.00.00,,801.0,30.0,,464.0,,1749.0,,1154.0,340.0,"16,1","42,4","0,7718",,,2004-07-04
07/04/2004,04.00.00,,804.0,30.0,,468.0,12.0,1826.0,19.0,1166.0,320.0,"15,7","45,4","0,8063",,,2004-07-04
07/04/2004,05.00.00,,824.0,32.0,,478.0,22.0,1705.0,32.0,1200.0,331.0,"15,3","50,1","0,8617",,,2004-07-04
07/04/2004,06.00.00,,1000.0,59.0,,688.0,55.0,1257.0,61.0,1398.0,426.0,"14,2","58,6","0,9443",,,2004-07-04
07/04/2004,07.00.00,,1307.0,277.0,,1082.0,152.0,777.0,111.0,1769.0,830.0,"14,3","58,2","0,9431",,,2004-07-04
07/04/2004,08.00.00,,1286.0,454.0,,1171.0,153.0,716.0,102.0,1821.0,1006.0,"15,0","52,0","0,8817",,,2004-07-04
07/04/2004,09.00.00,,1150.0,211.0,,925.0,152.0,865.0,116.0,1576.0,820.0,"13,6","61,4","0,9519",,,2004-07-04
07/04/2004,10.00.00,,1087.0,196.0,,876.0,112.0,911.0,96.0,1554.0,737.0,"16,1","53,1","0,9675",,,2004-07-04
07/04/2004,11.00.00,,1016.0,110.0,,839.0,119.0,991.0,97.0,1448.0,790.0,"16,6","44,3","0,8294",,,2004-07-04
07/04/2004,12.00.00,,1029.0,164.0,,892.0,122.0,937.0,110.0,1474.0,760.0,"17,4","40,3","0,7922",,,2004-07-04
07/04/2004,13.00.00,,1109.0,151.0,,943.0,115.0,883.0,103.0,1604.0,767.0,"18,1","42,2","0,8679",,,2004-07-04
07/04/2004,14.00.00,,997.0,112.0,,817.0,84.0,1030.0,79.0,1426.0,626.0,"14,4","51,8","0,8433",,,2004-07-04
07/04/2004,15.00.00,,1177.0,117.0,,880.0,146.0,927.0,104.0,1552.0,776.0,"10,9","76,4","0,9953",,,2004-07-04
07/04/2004,16.00.00,,1045.0,120.0,,808.0,65.0,1038.0,69.0,1421.0,589.0,"16,4","47,7","0,8819",,,2004-07-04
07/04/2004,17.00.00,,1171.0,251.0,,1073.0,120.0,847.0,96.0,1623.0,872.0,"18,0","37,1","0,7598",,,2004-07-04
07/04/2004,18.00.00,,1221.0,435.0,,1101.0,185.0,799.0,121.0,1700.0,996.0,"14,7","48,7","0,8089",,,2004-07-04
07/04/2004,19.00.00,,1262.0,345.0,,1133.0,157.0,774.0,129.0,1748.0,1033.0,"11,3","71,3","0,9514",,,2004-07-04
07/04/2004,20.00.00,,1207.0,343.0,,1013.0,174.0,876.0,116.0,1632.0,982.0,"10,0","74,0","0,9087",,,2004-07-04
07/04/2004,21.00.00,,956.0,62.0,,666.0,62.0,1235.0,71.0,1282.0,518.0,"9,8","71,8","0,8702",,,2004-07-04
07/04/2004,22.00.00,,1020.0,70.0,,727.0,81.0,1153.0,85.0,1391.0,631.0,"9,3","75,2","0,8796",,,2004-07-04
07/04/2004,23.00.00,,1107.0,114.0,,861.0,118.0,957.0,101.0,1510.0,879.0,"9,6","76,0","0,9088",,,2004-07-04
08/04/2004,00.00.00,,1020.0,88.0,,752.0,95.0,1074.0,97.0,1398.0,839.0,"9,3","75,0","0,8799",,,2004-08-04
08/04/2004,01.00.00,,1051.0,95.0,,798.0,84.0,1016.0,89.0,1455.0,876.0,"9,0","76,7","0,8825",,,2004-08-04
08/04/2004,02.00.00,,965.0,83.0,,716.0,56.0,1087.0,72.0,1383.0,827.0,"8,2","79,6","0,8672",,,2004-08-04
08/04/2004,03.00.00,,890.0,63.0,,672.0,,1183.0,,1338.0,781.0,"7,6","80,6","0,8437",,,2004-08-04
08/04/2004,04.00.00,-200.0,823.0,38.0,,568.0,43.0,1366.0,57.0,1263.0,699.0,"8,3","75,6","0,8302",,,2004-08-04
08/04/2004,05.00.00,,869.0,68.0,,642.0,69.0,1291.0,62.0,1288.0,723.0,"8,1","72,1","0,7798",,,2004-08-04
08/04/2004,06.00.00,,939.0,59.0,,754.0,74.0,1169.0,64.0,1384.0,797.0,"8,1","70,4","0,7609",,,2004-08-04
08/04/2004,07.00.00,,1274.0,226.0,,1109.0,161.0,820.0,80.0,1723.0,1138.0,"8,1","70,5","0,7627",,,2004-08-04
08/04/2004,08.00.00,,1512.0,802.0,,1482.0,308.0,596.0,118.0,2189.0,1605.0,"9,9","64,3","0,7859",,,2004-08-04
08/04/2004,09.00.00,,1435.0,585.0,,1271.0,300.0,676.0,130.0,1885.0,1569.0,"13,0","54,2","0,8090",,,2004-08-04
08/04/2004,10.00.00,,1207.0,324.0,,1041.0,189.0,813.0,113.0,1620.0,1319.0,"16,5","42,6","0,7912",,,2004-08-04
08/04/2004,11.00.00,,1223.0,308.0,,1075.0,164.0,818.0,112.0,1678.0,1198.0,"19,3","34,2","0,7566",,,2004-08-04
08/04/2004,12.00.00,,1121.0,238.0,,1026.0,122.0,865.0,96.0,1541.0,958.0,"21,5","27,4","0,6941",,,2004-08-04
08/04/2004,13.00.00,,1176.0,301.0,,1123.0,166.0,816.0,125.0,1609.0,1068.0,"20,4","26,7","0,6323",,,2004-08-04
08/04/2004,14.00.00,,1144.0,294.0,,1114.0,181.0,845.0,128.0,1551.0,1010.0,"20,6","22,6","0,5432",,,2004-08-04
08/04/2004,15.00.00,,1136.0,353.0,,1089.0,127.0,856.0,101.0,1552.0,928.0,"20,6","24,8","0,5931",,,2004-08-04
08/04/2004,16.00.00,,1085.0,209.0,,1004.0,106.0,888.0,95.0,1454.0,816.0,"21,0","25,4","0,6264",,,2004-08-04
08/04/2004,17.00.00,,1297.0,538.0,,1287.0,192.0,723.0,138.0,1798.0,1216.0,"21,5","24,5","0,6203",,,2004-08-04
08/04/2004,18.00.00,,1408.0,808.0,,1404.0,241.0,646.0,154.0,1972.0,1463.0,"19,3","28,6","0,6357",,,2004-08-04
08/04/2004,19.00.00,,1618.0,974.0,,1530.0,326.0,579.0,171.0,2167.0,1791.0,"18,0","32,9","0,6737",,,2004-08-04
08/04/2004,20.00.00,,1319.0,544.0,,1172.0,232.0,746.0,136.0,1699.0,1425.0,"15,8","39,8","0,7096",,,2004-08-04
08/04/2004,21.00.00,,1045.0,138.0,,857.0,92.0,968.0,93.0,1410.0,922.0,"15,3","41,5","0,7194",,,2004-08-04
08/04/2004,22.00.00,,1058.0,92.0,,824.0,95.0,993.0,99.0,1411.0,971.0,"14,1","46,0","0,7363",,,2004-08-04
08/04/2004,23.00.00,2.0,,137.0,,,129.0,,106.0,,,-200,-200,-200,,,2004-08-04
09/04/2004,00.00.00,,,189.0,,,154.0,,109.0,,,-200,-200,-200,,,2004-09-04
09/04/2004,01.00.00,,,159.0,,,118.0,,97.0,,,-200,-200,-200,,,2004-09-04
09/04/2004,02.00.00,1.0,,80.0,,,69.0,,83.0,,,-200,-200,-200,,,2004-09-04
09/04/2004,03.00.00,1.0,,66.0,,,,,,,,-200,-200,-200,,,2004-09-04
09/04/2004,04.00.00,1.0,,87.0,,,97.0,,79.0,,,-200,-200,-200,,,2004-09-04
09/04/2004,05.00.00,,,79.0,,,145.0,,84.0,,,-200,-200,-200,,,2004-09-04
09/04/2004,06.00.00,,,150.0,,,169.0,,86.0,,,-200,-200,-200,,,2004-09-04
09/04/2004,07.00.00,,,196.0,,,250.0,,111.0,,,-200,-200,-200,,,2004-09-04
09/04/2004,08.00.00,,,299.0,,,215.0,,117.0,,,-200,-200,-200,,,2004-09-04
09/04/2004,09.00.00,,,254.0,,,237.0,,122.0,,,-200,-200,-200,,,2004-09-04
09/04/2004,10.00.00,,,226.0,,,190.0,,119.0,,,-200,-200,-200,,,2004-09-04
09/04/2004,11.00.00,,,262.0,,,219.0,,121.0,,,-200,-200,-200,,,2004-09-04
09/04/2004,12.00.00,,,505.0,,,294.0,,127.0,,,-200,-200,-200,,,2004-09-04
09/04/2004,13.00.00,,,512.0,,,253.0,,135.0,,,-200,-200,-200,,,2004-09-04
09/04/2004,14.00.00,,,159.0,,,176.0,,119.0,,,-200,-200,-200,,,2004-09-04
09/04/2004,15.00.00,,,337.0,,,243.0,,137.0,,,-200,-200,-200,,,2004-09-04
09/04/2004,16.00.00,,,357.0,,,214.0,,139.0,,,-200,-200,-200,,,2004-09-04
09/04/2004,17.00.00,,,194.0,,,141.0,,117.0,,,-200,-200,-200,,,2004-09-04
09/04/2004,18.00.00,,,278.0,,,166.0,,127.0,,,-200,-200,-200,,,2004-09-04
09/04/2004,19.00.00,,,303.0,,,197.0,,137.0,,,-200,-200,-200,,,2004-09-04
09/04/2004,20.00.00,3.0,,234.0,,,191.0,,127.0,,,-200,-200,-200,,,2004-09-04
09/04/2004,21.00.00,,,128.0,,,159.0,,107.0,,,-200,-200,-200,,,2004-09-04
09/04/2004,22.00.00,,,160.0,,,175.0,,102.0,,,-200,-200,-200,,,2004-09-04
09/04/2004,23.00.00,,1176.0,169.0,,917.0,157.0,866.0,95.0,1560.0,1151.0,"12,0","67,9","0,9523",,,2004-09-04
10/04/2004,00.00.00,,1047.0,77.0,,783.0,83.0,1014.0,79.0,1449.0,975.0,"12,0","66,9","0,9336",,,2004-10-04
10/04/2004,01.00.00,,1116.0,98.0,,854.0,118.0,929.0,78.0,1533.0,1034.0,"11,5","70,1","0,9503",,,2004-10-04
10/04/2004,02.00.00,,1074.0,102.0,,832.0,101.0,951.0,75.0,1507.0,980.0,"11,4","69,8","0,9390",,,2004-10-04
10/04/2004,03.00.00,1.0,922.0,65.0,,687.0,,1142.0,,1390.0,825.0,"11,1","69,3","0,9128",,,2004-10-04
10/04/2004,04.00.00,,898.0,69.0,,669.0,46.0,1163.0,52.0,1386.0,807.0,"10,8","70,3","0,9092",,,2004-10-04
10/04/2004,05.00.00,1.0,970.0,89.0,,708.0,81.0,1121.0,55.0,1435.0,842.0,"10,2","73,4","0,9129",,,2004-10-04
10/04/2004,06.00.00,,1073.0,134.0,,812.0,112.0,988.0,65.0,1500.0,950.0,"10,8","70,5","0,9142",,,2004-10-04
10/04/2004,07.00.00,,1081.0,157.0,,906.0,150.0,895.0,72.0,1591.0,1024.0,"11,0","71,0","0,9279",,,2004-10-04
10/04/2004,08.00.00,2.0,1159.0,167.0,,976.0,138.0,837.0,76.0,1663.0,1098.0,"12,4","64,0","0,9206",,,2004-10-04
10/04/2004,09.00.00,2.0,1112.0,157.0,,931.0,124.0,869.0,84.0,1588.0,1011.0,"15,0","53,1","0,8993",,,2004-10-04
10/04/2004,10.00.00,,1112.0,172.0,,917.0,124.0,897.0,90.0,1542.0,931.0,"16,6","44,4","0,8313",,,2004-10-04
10/04/2004,11.00.00,,1063.0,114.0,,877.0,115.0,971.0,89.0,1481.0,811.0,"18,0","38,4","0,7862",,,2004-10-04
10/04/2004,12.00.00,,1032.0,166.0,,892.0,101.0,973.0,87.0,1457.0,756.0,"20,6","30,0","0,7213",,,2004-10-04
10/04/2004,13.00.00,,936.0,94.0,,829.0,90.0,1054.0,88.0,1336.0,607.0,"19,9","26,7","0,6137",,,2004-10-04
10/04/2004,14.00.00,,883.0,108.0,,766.0,90.0,1152.0,81.0,1238.0,498.0,"19,8","23,1","0,5283",,,2004-10-04
10/04/2004,15.00.00,,942.0,98.0,,852.0,89.0,1055.0,89.0,1318.0,540.0,"21,4","22,7","0,5722",,,2004-10-04
10/04/2004,16.00.00,,943.0,132.0,,850.0,92.0,1084.0,91.0,1296.0,544.0,"22,1","21,3","0,5605",,,2004-10-04
10/04/2004,17.00.00,,1007.0,144.0,,875.0,103.0,1027.0,104.0,1357.0,620.0,"21,1","24,5","0,6040",,,2004-10-04
10/04/2004,18.00.00,2.0,1037.0,165.0,,927.0,122.0,949.0,111.0,1426.0,740.0,"18,3","31,6","0,6562",,,2004-10-04
10/04/2004,19.00.00,,1127.0,210.0,,1022.0,159.0,871.0,129.0,1534.0,921.0,"16,1","35,0","0,6372",,,2004-10-04
10/04/2004,20.00.00,,1123.0,277.0,,996.0,172.0,861.0,133.0,1551.0,1033.0,"14,8","41,5","0,6929",,,2004-10-04
10/04/2004,21.00.00,2.0,1110.0,168.0,,909.0,125.0,916.0,115.0,1487.0,984.0,"13,2","50,3","0,7577",,,2004-10-04
10/04/2004,22.00.00,,1247.0,248.0,,1037.0,187.0,812.0,125.0,1618.0,1193.0,"12,3","55,5","0,7916",,,2004-10-04
10/04/2004,23.00.00,,1220.0,235.0,,967.0,174.0,844.0,117.0,1545.0,1219.0,"11,8","56,6","0,7833",,,2004-10-04
11/04/2004,00.00.00,,1028.0,84.0,,770.0,75.0,1047.0,84.0,1326.0,913.0,"11,2","56,2","0,7469",,,2004-11-04
11/04/2004,01.00.00,,978.0,75.0,,711.0,48.0,1144.0,63.0,1304.0,750.0,"11,0","56,6","0,7418",,,2004-11-04
11/04/2004,02.00.00,1.0,949.0,62.0,,694.0,61.0,1160.0,68.0,1310.0,772.0,"9,3","64,3","0,7531",,,2004-11-04
11/04/2004,03.00.00,1.0,910.0,66.0,,709.0,,1162.0,,1329.0,712.0,"8,8","66,0","0,7501",,,2004-11-04
11/04/2004,04.00.00,-200.0,863.0,49.0,,651.0,38.0,1224.0,52.0,1286.0,712.0,"7,8","70,4","0,7463",,,2004-11-04
11/04/2004,05.00.00,,836.0,38.0,,643.0,38.0,1244.0,49.0,1306.0,727.0,"7,7","70,7","0,7463",,,2004-11-04
11/04/2004,06.00.00,,856.0,44.0,,644.0,41.0,1259.0,49.0,1301.0,746.0,"7,4","71,0","0,7346",,,2004-11-04
11/04/2004,07.00.00,,888.0,60.0,,651.0,51.0,1240.0,52.0,1298.0,733.0,"8,2","66,6","0,7283",,,2004-11-04
11/04/2004,08.00.00,,912.0,88.0,,694.0,61.0,1196.0,58.0,1343.0,727.0,"8,7","64,3","0,7267",,,2004-11-04
11/04/2004,09.00.00,1.0,938.0,70.0,,706.0,47.0,1177.0,51.0,1320.0,642.0,"13,0","47,9","0,7116",,,2004-11-04
11/04/2004,10.00.00,,1053.0,94.0,,823.0,87.0,1040.0,77.0,1386.0,810.0,"17,4","35,4","0,6990",,,2004-11-04
11/04/2004,11.00.00,,1087.0,126.0,,870.0,107.0,1014.0,90.0,1412.0,851.0,"20,2","29,2","0,6830",,,2004-11-04
11/04/2004,12.00.00,,1153.0,181.0,,945.0,161.0,969.0,118.0,1425.0,911.0,"22,7","22,9","0,6224",,,2004-11-04
11/04/2004,13.00.00,,894.0,66.0,,710.0,61.0,1209.0,70.0,1200.0,611.0,"22,3","22,4","0,5955",,,2004-11-04
11/04/2004,14.00.00,,797.0,54.0,,606.0,26.0,1452.0,35.0,1076.0,368.0,"22,2","18,9","0,4993",,,2004-11-04
11/04/2004,15.00.00,,854.0,48.0,,658.0,42.0,1409.0,46.0,1108.0,369.0,"22,0","19,0","0,4969",,,2004-11-04
11/04/2004,16.00.00,1.0,892.0,66.0,,665.0,55.0,1348.0,58.0,1150.0,394.0,"21,0","23,6","0,5788",,,2004-11-04
11/04/2004,17.00.00,,935.0,65.0,,672.0,65.0,1299.0,61.0,1183.0,415.0,"19,6","27,4","0,6162",,,2004-11-04
11/04/2004,18.00.00,,989.0,68.0,,709.0,75.0,1225.0,80.0,1233.0,469.0,"17,9","30,8","0,6258",,,2004-11-04
11/04/2004,19.00.00,2.0,1063.0,118.0,,797.0,93.0,1079.0,93.0,1285.0,607.0,"16,4","35,3","0,6532",,,2004-11-04
11/04/2004,20.00.00,,922.0,65.0,,674.0,63.0,1220.0,78.0,1205.0,498.0,"15,6","37,5","0,6575",,,2004-11-04
11/04/2004,21.00.00,,925.0,63.0,,680.0,60.0,1223.0,76.0,1217.0,481.0,"15,5","36,7","0,6438",,,2004-11-04
11/04/2004,22.00.00,,924.0,61.0,,648.0,63.0,1272.0,74.0,1186.0,465.0,"14,5","39,0","0,6428",,,2004-11-04
11/04/2004,23.00.00,,914.0,63.0,,661.0,66.0,1256.0,81.0,1187.0,478.0,"14,2","38,2","0,6163",,,2004-11-04
12/04/2004,00.00.00,,840.0,31.0,,556.0,41.0,1474.0,58.0,1094.0,366.0,"13,7","38,3","0,5957",,,2004-12-04
12/04/2004,01.00.00,,799.0,29.0,,514.0,42.0,1615.0,59.0,1036.0,332.0,"14,1","34,0","0,5442",,,2004-12-04
12/04/2004,02.00.00,,856.0,34.0,,581.0,36.0,1448.0,54.0,1111.0,346.0,"14,6","34,0","0,5605",,,2004-12-04
12/04/2004,03.00.00,,830.0,34.0,,560.0,,1452.0,,1066.0,350.0,"14,4","32,8","0,5364",,,2004-12-04
12/04/2004,04.00.00,,753.0,9.0,,462.0,16.0,1822.0,25.0,955.0,274.0,"13,9","30,9","0,4868",,,2004-12-04
12/04/2004,05.00.00,,785.0,14.0,,448.0,16.0,1923.0,26.0,1003.0,263.0,"13,5","37,9","0,5852",,,2004-12-04
12/04/2004,06.00.00,,835.0,23.0,,472.0,33.0,1756.0,49.0,1117.0,314.0,"13,9","43,6","0,6871",,,2004-12-04
12/04/2004,07.00.00,,865.0,36.0,,494.0,39.0,1613.0,53.0,1185.0,367.0,"13,5","50,1","0,7706",,,2004-12-04
12/04/2004,08.00.00,,922.0,39.0,,541.0,45.0,1453.0,57.0,1246.0,432.0,"13,3","53,6","0,8169",,,2004-12-04
12/04/2004,09.00.00,,975.0,38.0,,598.0,63.0,1268.0,73.0,1293.0,536.0,"13,4","56,0","0,8576",,,2004-12-04
12/04/2004,10.00.00,1.0,1040.0,55.0,,646.0,71.0,1210.0,78.0,1325.0,555.0,"13,0","59,6","0,8860",,,2004-12-04
12/04/2004,11.00.00,,1115.0,75.0,,707.0,104.0,1105.0,93.0,1384.0,677.0,"12,7","62,7","0,9173",,,2004-12-04
12/04/2004,12.00.00,,1004.0,64.0,,641.0,85.0,1201.0,71.0,1305.0,557.0,"12,1","60,5","0,8505",,,2004-12-04
12/04/2004,13.00.00,,895.0,39.0,,536.0,53.0,1415.0,56.0,1229.0,421.0,"11,2","64,4","0,8537",,,2004-12-04
12/04/2004,14.00.00,,917.0,42.0,,563.0,58.0,1415.0,60.0,1257.0,423.0,"10,7","67,6","0,8703",,,2004-12-04
12/04/2004,15.00.00,,1025.0,78.0,,689.0,89.0,1189.0,77.0,1325.0,519.0,"11,4","61,2","0,8236",,,2004-12-04
12/04/2004,16.00.00,,1035.0,69.0,,660.0,96.0,1222.0,82.0,1301.0,533.0,"9,9","70,5","0,8581",,,2004-12-04
12/04/2004,17.00.00,,1025.0,67.0,,682.0,88.0,1197.0,77.0,1313.0,537.0,"10,3","65,2","0,8151",,,2004-12-04
12/04/2004,18.00.00,,1040.0,83.0,,705.0,100.0,1149.0,91.0,1324.0,612.0,"11,0","58,9","0,7714",,,2004-12-04
12/04/2004,19.00.00,,1070.0,79.0,,776.0,127.0,1065.0,93.0,1369.0,697.0,"10,6","59,5","0,7595",,,2004-12-04
12/04/2004,20.00.00,,964.0,68.0,,692.0,88.0,1176.0,82.0,1292.0,573.0,"10,6","57,7","0,7362",,,2004-12-04
12/04/2004,21.00.00,,904.0,56.0,,635.0,66.0,1269.0,74.0,1233.0,489.0,"10,6","56,1","0,7149",,,2004-12-04
12/04/2004,22.00.00,,913.0,49.0,,626.0,61.0,1271.0,68.0,1234.0,474.0,"10,3","58,0","0,7239",,,2004-12-04
12/04/2004,23.00.00,,914.0,56.0,,610.0,54.0,1322.0,65.0,1230.0,455.0,"10,4","58,4","0,7352",,,2004-12-04
13/04/2004,00.00.00,,893.0,48.0,,587.0,46.0,1368.0,58.0,1219.0,433.0,"10,7","58,2","0,7459",,,
13/04/2004,01.00.00,,844.0,27.0,,532.0,25.0,1499.0,36.0,1176.0,376.0,"10,5","59,9","0,7624",,,
13/04/2004,02.00.00,,837.0,29.0,,518.0,18.0,1581.0,29.0,1182.0,360.0,"10,5","60,8","0,7704",,,
13/04/2004,03.00.00,,868.0,32.0,,530.0,,1482.0,,1215.0,384.0,"10,6","63,1","0,8068",,,
13/04/2004,04.00.00,,825.0,47.0,,489.0,21.0,1565.0,28.0,1171.0,363.0,"11,1","60,1","0,7925",,,
13/04/2004,05.00.00,,956.0,66.0,,656.0,76.0,1251.0,68.0,1356.0,525.0,"10,1","68,4","0,8443",,,
13/04/2004,06.00.00,,1124.0,163.0,,853.0,149.0,960.0,99.0,1531.0,873.0,"10,0","68,7","0,8456",,,
13/04/2004,07.00.00,,1496.0,524.0,,1272.0,328.0,667.0,130.0,2011.0,1399.0,"11,0","64,2","0,8398",,,
13/04/2004,08.00.00,,1452.0,657.0,,1354.0,282.0,620.0,128.0,2057.0,1501.0,"12,0","58,1","0,8138",,,
13/04/2004,09.00.00,,1172.0,324.0,,1042.0,206.0,797.0,120.0,1641.0,1186.0,"12,8","52,0","0,7643",,,
13/04/2004,10.00.00,,1020.0,144.0,,871.0,133.0,956.0,93.0,1426.0,911.0,"12,6","50,8","0,7387",,,
13/04/2004,11.00.00,,1044.0,135.0,,900.0,137.0,934.0,96.0,1471.0,919.0,"13,8","47,4","0,7435",,,
13/04/2004,12.00.00,,1020.0,140.0,,866.0,116.0,972.0,84.0,1429.0,791.0,"15,1","42,7","0,7294",,,
13/04/2004,13.00.00,,1009.0,141.0,,885.0,112.0,994.0,87.0,1439.0,751.0,"16,3","38,1","0,7006",,,
13/04/2004,14.00.00,,1073.0,181.0,,966.0,128.0,935.0,87.0,1537.0,805.0,"16,6","36,7","0,6867",,,
13/04/2004,15.00.00,,1098.0,227.0,,971.0,145.0,877.0,103.0,1527.0,966.0,"15,8","40,5","0,7241",,,
13/04/2004,16.00.00,,1061.0,149.0,,887.0,110.0,920.0,88.0,1462.0,869.0,"16,3","41,8","0,7712",,,
13/04/2004,17.00.00,3.0,1289.0,425.0,,1158.0,184.0,755.0,118.0,1791.0,1196.0,"16,1","42,8","0,7783",,,
13/04/2004,18.00.00,,1442.0,669.0,,1337.0,243.0,630.0,134.0,2004.0,1523.0,"15,3","46,8","0,8074",,,
13/04/2004,19.00.00,5.0,1479.0,680.0,,1343.0,259.0,631.0,144.0,1995.0,1579.0,"14,7","47,0","0,7815",,,
13/04/2004,20.00.00,,1266.0,446.0,,1138.0,205.0,726.0,129.0,1747.0,1370.0,"14,1","49,6","0,7931",,,
13/04/2004,21.00.00,,1149.0,205.0,,952.0,144.0,845.0,108.0,1577.0,1204.0,"13,5","54,1","0,8351",,,
13/04/2004,22.00.00,,1168.0,194.0,,954.0,152.0,843.0,104.0,1586.0,1201.0,"12,3","59,2","0,8461",,,
13/04/2004,23.00.00,,1079.0,115.0,,847.0,108.0,925.0,90.0,1463.0,1122.0,"11,6","62,2","0,8510",,,
14/04/2004,00.00.00,,1047.0,74.0,,760.0,64.0,1032.0,74.0,1379.0,1003.0,"11,5","61,4","0,8303",,,
14/04/2004,01.00.00,,936.0,85.0,,705.0,73.0,1086.0,73.0,1364.0,918.0,"10,9","64,6","0,8395",,,
14/04/2004,02.00.00,,900.0,66.0,,635.0,47.0,1207.0,60.0,1307.0,836.0,"11,1","63,2","0,8331",,,
14/04/2004,03.00.00,,839.0,60.0,,576.0,,1325.0,,1285.0,759.0,"10,7","64,4","0,8284",,,
14/04/2004,04.00.00,-200.0,840.0,40.0,,563.0,45.0,1349.0,57.0,1275.0,755.0,"10,7","63,8","0,8174",,,
14/04/2004,05.00.00,,905.0,47.0,,670.0,79.0,1191.0,62.0,1346.0,820.0,"10,2","65,8","0,8196",,,
14/04/2004,06.00.00,,1079.0,116.0,,875.0,113.0,947.0,71.0,1535.0,998.0,"10,3","65,6","0,8225",,,
14/04/2004,07.00.00,,1417.0,478.0,,1246.0,263.0,669.0,94.0,1921.0,1403.0,"10,8","64,0","0,8307",,,
14/04/2004,08.00.00,5.0,1529.0,836.0,,1497.0,275.0,569.0,99.0,2278.0,1641.0,"13,3","55,6","0,8453",,,
14/04/2004,09.00.00,,1397.0,655.0,,1248.0,263.0,659.0,119.0,1906.0,1534.0,"15,8","46,8","0,8328",,,
14/04/2004,10.00.00,,1214.0,312.0,,1061.0,183.0,780.0,103.0,1662.0,1257.0,"19,5","34,4","0,7738",,,
14/04/2004,11.00.00,,1109.0,195.0,,935.0,147.0,882.0,95.0,1518.0,1026.0,"21,1","30,2","0,7450",,,
14/04/2004,12.00.00,,1122.0,238.0,,993.0,132.0,859.0,95.0,1571.0,993.0,"18,4","34,2","0,7185",,,
14/04/2004,13.00.00,-200.0,1094.0,,,966.0,,877.0,,1519.0,919.0,"21,0","30,6","0,7538",,,
14/04/2004,14.00.00,-200.0,1164.0,,,1076.0,,788.0,,1653.0,1032.0,"21,4","28,7","0,7231",,,
14/04/2004,15.00.00,-200.0,1188.0,,,1082.0,,790.0,,1653.0,1077.0,"21,3","27,3","0,6856",,,
14/04/2004,16.00.00,-200.0,1098.0,,,934.0,,895.0,,1497.0,883.0,"20,4","30,4","0,7193",,,
14/04/2004,17.00.00,-200.0,1180.0,,,1014.0,,826.0,,1595.0,1036.0,"18,7","34,8","0,7436",,,
14/04/2004,18.00.00,-200.0,1195.0,,,1072.0,,799.0,,1609.0,1144.0,"18,6","34,7","0,7369",,,
14/04/2004,19.00.00,-200.0,1234.0,,,1095.0,,789.0,,1638.0,1212.0,"17,9","35,8","0,7276",,,
14/04/2004,20.00.00,-200.0,1425.0,,,1242.0,,675.0,,1858.0,1486.0,"16,5","42,1","0,7856",,,
14/04/2004,21.00.00,-200.0,1320.0,,,1085.0,,730.0,,1689.0,1440.0,"14,8","49,7","0,8321",,,
14/04/2004,22.00.00,-200.0,1158.0,,,892.0,,870.0,,1494.0,1242.0,"13,4","54,3","0,8291",,,
14/04/2004,23.00.00,-200.0,1060.0,,,805.0,,964.0,,1418.0,1089.0,"13,4","54,2","0,8319",,,
15/04/2004,00.00.00,-200.0,1036.0,,,746.0,,1034.0,,1364.0,993.0,"12,3","57,6","0,8223",,,
15/04/2004,01.00.00,-200.0,943.0,,,660.0,,1163.0,,1297.0,862.0,"11,6","58,8","0,7996",,,
15/04/2004,02.00.00,-200.0,899.0,,,591.0,,1243.0,,1259.0,815.0,"10,7","62,3","0,7988",,,
15/04/2004,03.00.00,-200.0,889.0,,,559.0,,1331.0,,1241.0,714.0,"10,2","63,2","0,7865",,,
15/04/2004,04.00.00,-200.0,847.0,,,527.0,,1416.0,,1216.0,682.0,"10,5","61,3","0,7761",,,
15/04/2004,05.00.00,-200.0,918.0,,,625.0,,1255.0,,1298.0,744.0,"9,3","65,8","0,7722",,,
15/04/2004,06.00.00,-200.0,1105.0,,,897.0,,906.0,,1510.0,1050.0,"9,1","67,4","0,7814",,,
15/04/2004,07.00.00,-200.0,1491.0,,,1335.0,,625.0,,2001.0,1522.0,"10,2","62,9","0,7831",,,
15/04/2004,08.00.00,-200.0,1508.0,,,1355.0,,609.0,,2034.0,1623.0,"11,6","58,7","0,7999",,,
15/04/2004,09.00.00,,1489.0,536.0,,1270.0,309.0,633.0,114.0,1889.0,1638.0,"13,5","53,4","0,8196",,,
15/04/2004,10.00.00,,1451.0,481.0,,1219.0,327.0,661.0,127.0,1804.0,1633.0,"15,0","49,3","0,8364",,,
15/04/2004,11.00.00,,1454.0,460.0,,1225.0,299.0,661.0,135.0,1809.0,1654.0,"17,1","42,1","0,8120",,,
15/04/2004,12.00.00,,1392.0,597.0,,1210.0,257.0,689.0,135.0,1792.0,1559.0,"18,4","36,9","0,7758",,,
15/04/2004,13.00.00,,1351.0,465.0,,1210.0,195.0,709.0,120.0,1783.0,1374.0,"19,3","35,4","0,7824",,,
15/04/2004,14.00.00,4.0,1418.0,542.0,,1282.0,231.0,681.0,129.0,1890.0,1418.0,"19,2","35,7","0,7826",,,
15/04/2004,15.00.00,3.0,1303.0,437.0,,1143.0,170.0,748.0,114.0,1734.0,1228.0,"21,5","30,4","0,7677",,,
15/04/2004,16.00.00,,1292.0,383.0,,1116.0,192.0,746.0,129.0,1676.0,1293.0,"19,6","34,6","0,7807",,,
15/04/2004,17.00.00,,1560.0,778.0,,1413.0,251.0,594.0,149.0,2046.0,1642.0,"19,6","35,5","0,8017",,,
15/04/2004,18.00.00,,1765.0,926.0,,1507.0,289.0,533.0,149.0,2271.0,1895.0,"18,3","44,1","0,9183",,,
15/04/2004,19.00.00,,1875.0,1189.0,,1637.0,351.0,482.0,158.0,2446.0,2086.0,"17,4","47,8","0,9392",,,
15/04/2004,20.00.00,,1746.0,824.0,,1409.0,319.0,553.0,148.0,2119.0,1898.0,"16,8","49,8","0,9446",,,
15/04/2004,21.00.00,,1607.0,660.0,,1290.0,264.0,587.0,134.0,1960.0,1758.0,"16,2","53,2","0,9723",,,
15/04/2004,22.00.00,,1277.0,203.0,,952.0,144.0,802.0,111.0,1607.0,1284.0,"14,9","59,1","0,9928",,,
15/04/2004,23.00.00,,1207.0,136.0,,868.0,119.0,877.0,106.0,1532.0,1075.0,"13,9","64,0","1,0130",,,
16/04/2004,00.00.00,2.0,1209.0,114.0,,863.0,120.0,882.0,108.0,1547.0,1084.0,"13,7","66,8","1,0410",,,
16/04/2004,01.00.00,,1189.0,110.0,,844.0,96.0,887.0,93.0,1566.0,1049.0,"13,4","69,6","1,0688",,,
16/04/2004,02.00.00,,1132.0,127.0,,810.0,77.0,899.0,83.0,1532.0,1021.0,"12,8","71,9","1,0632",,,
16/04/2004,03.00.00,1.0,974.0,68.0,,635.0,,1159.0,,1387.0,778.0,"12,9","68,5","1,0155",,,
16/04/2004,04.00.00,1.0,1033.0,70.0,,686.0,63.0,1030.0,69.0,1420.0,948.0,"11,9","74,8","1,0380",,,
16/04/2004,05.00.00,,1075.0,93.0,,782.0,97.0,941.0,77.0,1505.0,988.0,"11,6","76,4","1,0415",,,
16/04/2004,06.00.00,2.0,1242.0,179.0,,978.0,180.0,778.0,87.0,1686.0,1184.0,"11,7","75,3","1,0325",,,
16/04/2004,07.00.00,,1657.0,523.0,,1384.0,352.0,579.0,109.0,2176.0,1600.0,"12,8","71,0","1,0428",,,
16/04/2004,08.00.00,,1406.0,546.0,,1258.0,279.0,636.0,116.0,1890.0,1495.0,"13,8","61,1","0,9595",,,
16/04/2004,09.00.00,,1150.0,251.0,,973.0,186.0,827.0,105.0,1590.0,1188.0,"15,3","51,4","0,8886",,,
16/04/2004,10.00.00,,1184.0,222.0,,983.0,169.0,823.0,106.0,1604.0,1166.0,"16,6","48,7","0,9146",,,
16/04/2004,11.00.00,,1223.0,212.0,,1014.0,172.0,781.0,108.0,1666.0,1219.0,"17,6","46,7","0,9324",,,
16/04/2004,12.00.00,,1196.0,263.0,,997.0,127.0,802.0,100.0,1644.0,1128.0,"19,2","42,7","0,9425",,,
16/04/2004,13.00.00,,1559.0,535.0,,1267.0,230.0,653.0,149.0,2047.0,1373.0,"15,7","62,5","1,1092",,,
16/04/2004,14.00.00,,1544.0,609.0,,1266.0,280.0,613.0,148.0,2066.0,1415.0,"14,5","75,7","1,2425",,,
16/04/2004,15.00.00,4.0,1485.0,449.0,,1223.0,242.0,650.0,126.0,1980.0,1302.0,"14,4","77,4","1,2654",,,
16/04/2004,16.00.00,,1498.0,536.0,,1230.0,250.0,649.0,140.0,1963.0,1308.0,"14,6","74,9","1,2391",,,
16/04/2004,17.00.00,,1593.0,743.0,,1378.0,309.0,582.0,142.0,2159.0,1449.0,"14,6","76,0","1,2573",,,
16/04/2004,18.00.00,,1529.0,575.0,,1309.0,270.0,627.0,141.0,2083.0,1385.0,"14,0","76,3","1,2166",,,
16/04/2004,19.00.00,,1689.0,783.0,,1474.0,323.0,560.0,149.0,2298.0,1492.0,"13,9","78,0","1,2303",,,
16/04/2004,20.00.00,6.0,1535.0,706.0,,1295.0,307.0,627.0,140.0,2039.0,1380.0,"13,8","78,0","1,2229",,,
16/04/2004,21.00.00,,1304.0,299.0,,1067.0,224.0,737.0,117.0,1811.0,1167.0,"13,5","79,4","1,2224",,,
16/04/2004,22.00.00,,1235.0,159.0,,963.0,166.0,803.0,103.0,1680.0,1095.0,"13,1","80,1","1,2016",,,
16/04/2004,23.00.00,,1281.0,171.0,,977.0,171.0,794.0,99.0,1695.0,1105.0,"12,8","81,0","1,1915",,,
17/04/2004,00.00.00,,1167.0,162.0,,904.0,169.0,846.0,100.0,1627.0,1051.0,"12,7","80,6","1,1819",,,
17/04/2004,01.00.00,,1134.0,111.0,,863.0,120.0,869.0,88.0,1599.0,1009.0,"12,5","81,8","1,1838",,,
17/04/2004,02.00.00,,1100.0,134.0,,829.0,103.0,887.0,83.0,1565.0,972.0,"12,7","81,2","1,1849",,,
17/04/2004,03.00.00,-200.0,1057.0,,,768.0,,958.0,,1527.0,884.0,"12,4","82,4","1,1848",,,
17/04/2004,04.00.00,-200.0,902.0,,,652.0,,1158.0,,1437.0,661.0,"12,6","79,9","1,1619",,,
17/04/2004,05.00.00,-200.0,982.0,,,724.0,,1055.0,,1508.0,774.0,"12,8","80,0","1,1761",,,
17/04/2004,06.00.00,-200.0,997.0,,,769.0,,1002.0,,1524.0,868.0,"12,6","79,9","1,1596",,,
17/04/2004,07.00.00,-200.0,1141.0,,,902.0,,905.0,,1672.0,965.0,"12,5","79,6","1,1538",,,
17/04/2004,08.00.00,-200.0,1163.0,,,930.0,,849.0,,1691.0,985.0,"12,8","80,8","1,1863",,,
17/04/2004,09.00.00,-200.0,1107.0,,,864.0,,911.0,,1604.0,963.0,"13,5","78,1","1,1997",,,
17/04/2004,10.00.00,-200.0,1228.0,,,949.0,,838.0,,1706.0,1069.0,"14,6","74,9","1,2348",,,
17/04/2004,11.00.00,-200.0,1033.0,,,810.0,,969.0,,1526.0,864.0,"16,8","61,0","1,1599",,,
17/04/2004,12.00.00,-200.0,984.0,,,763.0,,1054.0,,1472.0,641.0,"18,8","50,1","1,0769",,,
17/04/2004,13.00.00,-200.0,1066.0,,,879.0,,939.0,,1536.0,740.0,"19,3","47,1","1,0445",,,
17/04/2004,14.00.00,-200.0,926.0,,,707.0,,1130.0,,1429.0,532.0,"19,3","46,6","1,0298",,,
17/04/2004,15.00.00,-200.0,979.0,,,764.0,,1054.0,,1462.0,572.0,"19,7","44,4","1,0081",,,
17/04/2004,16.00.00,-200.0,993.0,,,783.0,,1033.0,,1482.0,630.0,"19,3","45,7","1,0161",,,
17/04/2004,17.00.00,-200.0,970.0,,,763.0,,1043.0,,1462.0,608.0,"17,9","49,9","1,0135",,,
17/04/2004,18.00.00,-200.0,997.0,,,788.0,,1014.0,,1482.0,644.0,"16,9","53,2","1,0179",,,
17/04/2004,19.00.00,-200.0,1097.0,,,892.0,,909.0,,1594.0,833.0,"16,1","56,0","1,0151",,,
17/04/2004,20.00.00,-200.0,1105.0,,,908.0,,900.0,,1566.0,923.0,"16,5","52,8","0,9860",,,
17/04/2004,21.00.00,-200.0,993.0,,,777.0,,1022.0,,1482.0,790.0,"16,9","51,1","0,9743",,,
17/04/2004,22.00.00,-200.0,1136.0,,,896.0,,919.0,,1623.0,961.0,"17,0","50,8","0,9751",,,
17/04/2004,23.00.00,-200.0,1297.0,,,1003.0,,798.0,,1700.0,1177.0,"16,9","54,8","1,0455",,,
18/04/2004,00.00.00,-200.0,1110.0,,,855.0,,897.0,,1568.0,943.0,"16,3","57,2","1,0492",,,
18/04/2004,01.00.00,-200.0,1027.0,,,827.0,,942.0,,1529.0,742.0,"16,0","56,2","1,0164",,,
18/04/2004,02.00.00,-200.0,1024.0,,,795.0,,982.0,,1501.0,705.0,"15,6","60,2","1,0617",,,
18/04/2004,03.00.00,-200.0,992.0,,,783.0,,988.0,,1527.0,663.0,"14,6","68,2","1,1282",,,
18/04/2004,04.00.00,-200.0,929.0,,,664.0,,1144.0,,1449.0,536.0,"14,3","69,6","1,1257",,,
18/04/2004,05.00.00,-200.0,892.0,,,579.0,,1309.0,,1396.0,441.0,"13,8","71,9","1,1312",,,
18/04/2004,06.00.00,-200.0,895.0,,,609.0,,1268.0,,1410.0,477.0,"13,8","72,7","1,1402",,,
18/04/2004,07.00.00,-200.0,915.0,,,612.0,,1266.0,,1411.0,506.0,"14,2","72,3","1,1632",,,
18/04/2004,08.00.00,-200.0,947.0,,,649.0,,1154.0,,1459.0,608.0,"14,5","72,9","1,1950",,,
18/04/2004,09.00.00,-200.0,1032.0,,,721.0,,1052.0,,1546.0,663.0,"14,2","75,6","1,2201",,,
18/04/2004,10.00.00,-200.0,1219.0,,,849.0,,901.0,,1664.0,912.0,"14,5","77,2","1,2695",,,
18/04/2004,11.00.00,-200.0,1217.0,,,869.0,,873.0,,1660.0,963.0,"14,9","74,5","1,2530",,,
18/04/2004,12.00.00,-200.0,1097.0,,,779.0,,980.0,,1565.0,803.0,"15,5","67,4","1,1780",,,
18/04/2004,13.00.00,-200.0,938.0,,,674.0,,1136.0,,1433.0,564.0,"16,7","56,0","1,0544",,,
18/04/2004,14.00.00,-200.0,944.0,,,677.0,,1140.0,,1436.0,501.0,"17,1","55,5","1,0724",,,
18/04/2004,15.00.00,-200.0,1139.0,,,847.0,,929.0,,1604.0,701.0,"16,2","62,4","1,1423",,,
18/04/2004,16.00.00,-200.0,1163.0,,,859.0,,921.0,,1603.0,783.0,"17,4","58,9","1,1567",,,
18/04/2004,17.00.00,-200.0,1157.0,,,885.0,,916.0,,1590.0,784.0,"17,5","54,6","1,0800",,,
18/04/2004,18.00.00,-200.0,1154.0,,,919.0,,876.0,,1623.0,861.0,"17,5","54,2","1,0722",,,
18/04/2004,19.00.00,-200.0,1342.0,,,1102.0,,744.0,,1824.0,1156.0,"17,0","55,1","1,0621",,,
18/04/2004,20.00.00,-200.0,1178.0,,,949.0,,847.0,,1653.0,1047.0,"16,4","57,8","1,0669",,,
18/04/2004,21.00.00,-200.0,1152.0,,,926.0,,854.0,,1669.0,1034.0,"15,8","60,4","1,0744",,,
18/04/2004,22.00.00,-200.0,1078.0,,,841.0,,920.0,,1595.0,962.0,"15,5","63,3","1,1071",,,
18/04/2004,23.00.00,-200.0,1167.0,,,945.0,,826.0,,1702.0,1100.0,"15,0","65,2","1,1045",,,
19/04/2004,00.00.00,-200.0,1111.0,,,890.0,,871.0,,1658.0,1047.0,"14,5","67,3","1,1054",,,
19/04/2004,01.00.00,-200.0,988.0,,,722.0,,1029.0,,1500.0,874.0,"14,1","70,1","1,1224",,,
19/04/2004,02.00.00,-200.0,917.0,,,677.0,,1103.0,,1494.0,747.0,"13,8","73,3","1,1518",,,
19/04/2004,03.00.00,-200.0,850.0,,,562.0,,1275.0,,1407.0,589.0,"13,1","78,3","1,1716",,,
19/04/2004,04.00.00,-200.0,885.0,,,589.0,,1238.0,,1443.0,635.0,"13,0","78,2","1,1664",,,
19/04/2004,05.00.00,-200.0,888.0,,,597.0,,1242.0,,1428.0,671.0,"14,3","70,1","1,1328",,,
19/04/2004,06.00.00,-200.0,1101.0,,,852.0,,913.0,,1655.0,992.0,"14,0","70,9","1,1306",,,
19/04/2004,07.00.00,-200.0,1399.0,,,1195.0,,680.0,,1976.0,1308.0,"15,4","64,2","1,1123",,,
19/04/2004,08.00.00,-200.0,1325.0,,,1260.0,,652.0,,1969.0,1303.0,"16,5","57,9","1,0826",,,
19/04/2004,09.00.00,-200.0,1058.0,,,921.0,,876.0,,1594.0,893.0,"18,8","48,0","1,0323",,,
19/04/2004,10.00.00,-200.0,990.0,,,846.0,,947.0,,1503.0,715.0,"19,5","43,3","0,9706",,,
19/04/2004,11.00.00,-200.0,1018.0,,,879.0,,950.0,,1574.0,685.0,"18,5","45,5","0,9606",,,
19/04/2004,12.00.00,-200.0,1105.0,,,1010.0,,811.0,,1709.0,947.0,"18,0","46,7","0,9569",,,
19/04/2004,13.00.00,-200.0,1194.0,,,1097.0,,743.0,,1847.0,1049.0,"16,5","58,2","1,0813",,,
19/04/2004,14.00.00,-200.0,1088.0,,,893.0,,892.0,,1565.0,741.0,"12,1","75,6","1,0662",,,
19/04/2004,15.00.00,-200.0,1084.0,,,933.0,,872.0,,1602.0,801.0,"11,1","75,6","0,9974",,,
19/04/2004,16.00.00,-200.0,1207.0,,,1032.0,,797.0,,1701.0,969.0,"10,5","79,0","1,0016",,,
19/04/2004,17.00.00,-200.0,1186.0,,,1042.0,,808.0,,1684.0,1038.0,"10,0","80,5","0,9853",,,
19/04/2004,18.00.00,-200.0,1053.0,,,911.0,,916.0,,1528.0,889.0,"11,3","70,5","0,9389",,,
19/04/2004,19.00.00,-200.0,1032.0,,,895.0,,921.0,,1508.0,879.0,"10,7","71,5","0,9197",,,
19/04/2004,20.00.00,-200.0,989.0,,,846.0,,960.0,,1476.0,846.0,"9,9","74,0","0,9009",,,
19/04/2004,21.00.00,-200.0,930.0,,,745.0,,1085.0,,1391.0,712.0,"10,8","68,2","0,8806",,,
19/04/2004,22.00.00,-200.0,951.0,,,766.0,,1056.0,,1431.0,747.0,"10,2","74,0","0,9176",,,
19/04/2004,23.00.00,-200.0,985.0,,,780.0,,1017.0,,1444.0,791.0,"10,1","77,5","0,9579",,,
20/04/2004,00.00.00,-200.0,937.0,,,703.0,,1136.0,,1377.0,637.0,"9,9","77,7","0,9497",,,
20/04/2004,01.00.00,-200.0,887.0,,,648.0,,1222.0,,1357.0,553.0,"9,5","80,2","0,9533",,,
20/04/2004,02.00.00,-200.0,806.0,,,544.0,,1429.0,,1290.0,449.0,"9,5","79,7","0,9489",,,
20/04/2004,03.00.00,-200.0,771.0,,,483.0,,1587.0,,1277.0,485.0,"9,7","78,9","0,9487",,,
20/04/2004,04.00.00,-200.0,802.0,,,519.0,,1523.0,,1315.0,540.0,"9,8","80,0","0,9670",,,
20/04/2004,05.00.00,-200.0,878.0,,,644.0,,1260.0,,1410.0,685.0,"10,0","79,6","0,9800",,,
20/04/2004,06.00.00,-200.0,1070.0,,,883.0,,942.0,,1625.0,925.0,"10,3","79,4","0,9927",,,
20/04/2004,07.00.00,-200.0,1430.0,,,1316.0,,638.0,,2069.0,1382.0,"11,0","77,4","1,0135",,,
20/04/2004,08.00.00,-200.0,1565.0,,,1549.0,,540.0,,2396.0,1645.0,"12,3","69,2","0,9906",,,
20/04/2004,09.00.00,-200.0,1365.0,,,1299.0,,637.0,,1999.0,1514.0,"14,5","60,4","0,9936",,,
20/04/2004,10.00.00,-200.0,1348.0,,,1214.0,,678.0,,1874.0,1509.0,"16,0","56,3","1,0185",,,
20/04/2004,11.00.00,-200.0,1311.0,,,1279.0,,648.0,,1991.0,1520.0,"18,1","51,1","1,0551",,,
20/04/2004,12.00.00,-200.0,1302.0,,,1260.0,,658.0,,1970.0,1471.0,"23,0","37,5","1,0389",,,
20/04/2004,13.00.00,-200.0,1250.0,,,1173.0,,720.0,,1870.0,1282.0,"21,8","39,6","1,0209",,,
20/04/2004,14.00.00,-200.0,1083.0,,,988.0,,859.0,,1643.0,1004.0,"21,9","37,2","0,9683",,,
20/04/2004,15.00.00,-200.0,1005.0,,,894.0,,956.0,,1530.0,714.0,"23,8","31,4","0,9132",,,
20/04/2004,16.00.00,-200.0,1129.0,,,1107.0,,844.0,,1742.0,940.0,"25,9","26,9","0,8845",,,
20/04/2004,17.00.00,-200.0,1327.0,,,1289.0,,712.0,,1938.0,1272.0,"25,8","29,9","0,9808",,,
20/04/2004,18.00.00,-200.0,1428.0,,,1437.0,,599.0,,2156.0,1526.0,"22,6","39,5","1,0679",,,
20/04/2004,19.00.00,-200.0,1426.0,,,1400.0,,612.0,,2102.0,1488.0,"19,9","45,0","1,0364",,,
20/04/2004,20.00.00,-200.0,1310.0,,,1313.0,,663.0,,1958.0,1475.0,"17,9","47,4","0,9657",,,
20/04/2004,21.00.00,-200.0,1114.0,,,1059.0,,792.0,,1704.0,1182.0,"16,8","50,4","0,9545",,,
20/04/2004,22.00.00,-200.0,991.0,,,889.0,,932.0,,1550.0,933.0,"16,0","52,0","0,9375",,,
20/04/2004,23.00.00,-200.0,1089.0,,,940.0,,866.0,,1589.0,1001.0,"14,2","59,1","0,9520",,,
21/04/2004,00.00.00,-200.0,911.0,,,740.0,,1071.0,,1412.0,756.0,"14,2","56,7","0,9111",,,
21/04/2004,01.00.00,-200.0,1005.0,,,802.0,,976.0,,1474.0,952.0,"12,2","67,7","0,9625",,,
21/04/2004,02.00.00,-200.0,863.0,,,664.0,,1172.0,,1381.0,808.0,"13,2","61,7","0,9328",,,
21/04/2004,03.00.00,-200.0,857.0,,,653.0,,1197.0,,1375.0,779.0,"10,9","71,0","0,9249",,,
21/04/2004,04.00.00,-200.0,804.0,,,585.0,,1301.0,,1319.0,717.0,"11,3","67,6","0,9038",,,
21/04/2004,05.00.00,-200.0,871.0,,,694.0,,1160.0,,1421.0,779.0,"10,1","71,8","0,8880",,,
21/04/2004,06.00.00,-200.0,1035.0,,,929.0,,887.0,,1599.0,1009.0,"10,2","70,9","0,8841",,,
21/04/2004,07.00.00,-200.0,1513.0,,,1480.0,,572.0,,2249.0,1595.0,"11,8","66,0","0,9085",,,
21/04/2004,08.00.00,-200.0,1726.0,,,1776.0,,478.0,,2684.0,1940.0,"14,0","58,2","0,9271",,,
21/04/2004,09.00.00,-200.0,1396.0,,,1296.0,,619.0,,1991.0,1628.0,"17,0","50,2","0,9646",,,
21/04/2004,10.00.00,-200.0,1333.0,,,1212.0,,668.0,,1854.0,1573.0,"22,3","36,9","0,9838",,,
21/04/2004,11.00.00,-200.0,1161.0,,,1016.0,,849.0,,1642.0,1187.0,"24,4","30,9","0,9340",,,
21/04/2004,12.00.00,-200.0,1081.0,,,1000.0,,900.0,,1561.0,900.0,"25,9","26,7","0,8771",,,
21/04/2004,13.00.00,-200.0,1075.0,,,998.0,,914.0,,1574.0,800.0,"25,8","26,1","0,8540",,,
21/04/2004,14.00.00,-200.0,1055.0,,,964.0,,953.0,,1513.0,770.0,"26,3","24,8","0,8393",,,
21/04/2004,15.00.00,-200.0,1053.0,,,953.0,,988.0,,1483.0,758.0,"27,0","22,2","0,7805",,,
21/04/2004,16.00.00,-200.0,1087.0,,,1075.0,,944.0,,1558.0,886.0,"27,3","20,5","0,7308",,,
21/04/2004,17.00.00,-200.0,1304.0,,,1291.0,,765.0,,1838.0,1219.0,"25,8","24,1","0,7912",,,
21/04/2004,18.00.00,-200.0,1625.0,,,1608.0,,601.0,,2271.0,1725.0,"25,3","28,9","0,9151",,,
21/04/2004,19.00.00,-200.0,1649.0,,,1633.0,,584.0,,2328.0,1745.0,"23,8","33,7","0,9786",,,
21/04/2004,20.00.00,-200.0,1443.0,,,1455.0,,635.0,,2073.0,1600.0,"21,4","36,0","0,9059",,,
21/04/2004,21.00.00,-200.0,1209.0,,,1193.0,,753.0,,1737.0,1310.0,"19,8","39,5","0,9016",,,
21/04/2004,22.00.00,-200.0,1105.0,,,1000.0,,847.0,,1573.0,1208.0,"19,2","42,1","0,9273",,,
21/04/2004,23.00.00,-200.0,1020.0,,,863.0,,933.0,,1492.0,1074.0,"18,8","45,8","0,9855",,,
22/04/2004,00.00.00,-200.0,991.0,,,828.0,,973.0,,1469.0,993.0,"17,1","50,8","0,9828",,,
22/04/2004,01.00.00,-200.0,937.0,,,741.0,,1058.0,,1420.0,923.0,"16,2","53,4","0,9775",,,
